,number,value,datetime_start,datetime_complete,duration,params_activation,params_hidden_initializer,params_lr,params_n_layers,params_neurons,params_optimizer,params_output_initializer,state
844,844,0.6635090589523316,2023-05-18 18:49:32.827744,2023-05-18 18:49:39.827875,0 days 00:00:07.000131,sigmoid,1,0.00023997637544747282,2,128,2,1,COMPLETE
845,845,0.6631234049797058,2023-05-18 18:49:39.829059,2023-05-18 18:49:46.770753,0 days 00:00:06.941694,sigmoid,1,0.00044171834848370474,2,256,2,0,COMPLETE
846,846,0.6708215594291687,2023-05-18 18:49:46.771981,2023-05-18 18:49:53.968391,0 days 00:00:07.196410,sigmoid,1,0.0012723513718125093,2,256,2,1,COMPLETE
847,847,0.7171620845794677,2023-05-18 18:49:53.969570,2023-05-18 18:50:01.343106,0 days 00:00:07.373536,sigmoid,1,0.007426054145009621,3,256,2,1,COMPLETE
848,848,0.8909121751785278,2023-05-18 18:50:01.344296,2023-05-18 18:50:09.106559,0 days 00:00:07.762263,relu,1,0.0029235283864572858,2,256,2,1,COMPLETE
849,849,0.675074291229248,2023-05-18 18:50:09.107820,2023-05-18 18:50:18.473487,0 days 00:00:09.365667,sigmoid,1,0.003083296967323052,10,64,2,1,COMPLETE
850,850,0.7944697141647339,2023-05-18 18:50:18.474888,2023-05-18 18:50:25.645923,0 days 00:00:07.171035,sigmoid,1,7.013440217227036e-05,2,256,1,0,COMPLETE
851,851,0.6696340560913085,2023-05-18 18:50:25.647156,2023-05-18 18:50:32.519844,0 days 00:00:06.872688,sigmoid,1,0.0008244742083143216,2,256,2,1,COMPLETE
852,852,0.7179978966712952,2023-05-18 18:50:32.521033,2023-05-18 18:50:39.943686,0 days 00:00:07.422653,gelu,0,0.0005855811956024938,2,256,2,1,COMPLETE
853,853,0.7015832304954529,2023-05-18 18:50:39.944869,2023-05-18 18:50:47.532195,0 days 00:00:07.587326,elu,1,0.0003500802339341257,2,256,2,1,COMPLETE
854,854,0.675736403465271,2023-05-18 18:50:47.533692,2023-05-18 18:50:55.014132,0 days 00:00:07.480440,sigmoid,1,0.002270482077859823,2,128,2,1,COMPLETE
855,855,0.6624620676040649,2023-05-18 18:50:55.015337,2023-05-18 18:51:02.216056,0 days 00:00:07.200719,sigmoid,1,0.0001900325791436281,2,256,2,0,COMPLETE
856,856,0.6740947604179383,2023-05-18 18:51:02.217348,2023-05-18 18:51:10.241850,0 days 00:00:08.024502,sigmoid,1,0.0002161514690839266,7,256,2,1,COMPLETE
857,857,0.6899026274681092,2023-05-18 18:51:10.243054,2023-05-18 18:51:17.104221,0 days 00:00:06.861167,sigmoid,1,0.007290929762121008,2,256,2,1,COMPLETE
858,858,0.6714838981628418,2023-05-18 18:51:17.105500,2023-05-18 18:51:24.606618,0 days 00:00:07.501118,sigmoid,1,1.8689520122613223e-05,2,256,2,1,COMPLETE
859,859,0.742212975025177,2023-05-18 18:51:24.607937,2023-05-18 18:51:31.780288,0 days 00:00:07.172351,sigmoid,1,0.024390529234961683,2,256,2,1,COMPLETE
860,860,0.7208273053169251,2023-05-18 18:51:31.781640,2023-05-18 18:51:39.158946,0 days 00:00:07.377306,sigmoid,1,0.02132982337421346,2,256,2,1,COMPLETE
861,861,1.091587483882904,2023-05-18 18:51:39.160190,2023-05-18 18:51:45.911565,0 days 00:00:06.751375,selu,1,1.4821123225370282e-05,2,64,3,0,COMPLETE
862,862,0.6620200753211976,2023-05-18 18:51:45.912922,2023-05-18 18:51:52.820270,0 days 00:00:06.907348,sigmoid,1,0.0002606098155505874,2,256,2,1,COMPLETE
863,863,0.6668692827224731,2023-05-18 18:51:52.821544,2023-05-18 18:52:00.660016,0 days 00:00:07.838472,sigmoid,1,0.0003102592648744783,5,256,2,1,COMPLETE
864,864,0.6639004826545716,2023-05-18 18:52:00.661285,2023-05-18 18:52:08.166763,0 days 00:00:07.505478,sigmoid,1,0.0003986929448679127,2,256,2,1,COMPLETE
865,865,0.6766377449035644,2023-05-18 18:52:08.168008,2023-05-18 18:52:15.618990,0 days 00:00:07.450982,sigmoid,1,1.355330553950226e-05,2,256,2,1,COMPLETE
866,866,0.6638060450553894,2023-05-18 18:52:15.620248,2023-05-18 18:52:22.977849,0 days 00:00:07.357601,sigmoid,1,0.0002655335835401748,3,256,2,0,COMPLETE
867,867,0.8187645316123963,2023-05-18 18:52:22.979061,2023-05-18 18:52:30.265551,0 days 00:00:07.286490,tanh,1,0.08006449079732798,2,256,2,1,COMPLETE
868,868,0.6677046179771423,2023-05-18 18:52:30.266870,2023-05-18 18:52:37.383827,0 days 00:00:07.116957,sigmoid,1,0.0003516293482393695,2,256,0,1,COMPLETE
869,869,0.6930439710617066,2023-05-18 18:52:37.385012,2023-05-18 18:52:44.576022,0 days 00:00:07.191010,sigmoid,1,0.01657929132636618,2,256,2,1,COMPLETE
870,870,0.6629656195640564,2023-05-18 18:52:44.577199,2023-05-18 18:52:52.203301,0 days 00:00:07.626102,sigmoid,1,0.00025312432597764063,2,256,2,1,COMPLETE
871,871,0.6924224972724915,2023-05-18 18:52:52.204641,2023-05-18 18:52:59.451177,0 days 00:00:07.246536,sigmoid,1,0.05122462767988286,2,256,2,0,COMPLETE
872,872,0.6650611162185669,2023-05-18 18:52:59.452424,2023-05-18 18:53:06.787254,0 days 00:00:07.334830,sigmoid,1,8.990211024416743e-05,2,256,2,1,COMPLETE
873,873,0.6817730903625489,2023-05-18 18:53:06.788510,2023-05-18 18:53:14.330610,0 days 00:00:07.542100,linear,0,0.0002978539224922946,3,256,2,1,COMPLETE
874,874,0.663321590423584,2023-05-18 18:53:14.331878,2023-05-18 18:53:21.867267,0 days 00:00:07.535389,sigmoid,1,0.00044411482157766827,2,256,2,1,COMPLETE
875,875,0.6632933259010315,2023-05-18 18:53:21.868539,2023-05-18 18:53:28.631416,0 days 00:00:06.762877,sigmoid,1,0.00017325256858285835,2,256,2,1,COMPLETE
876,876,0.6745262980461121,2023-05-18 18:53:28.632611,2023-05-18 18:53:36.925962,0 days 00:00:08.293351,sigmoid,1,0.03130549498747649,4,256,1,0,COMPLETE
877,877,0.6826001167297363,2023-05-18 18:53:36.927344,2023-05-18 18:53:44.044409,0 days 00:00:07.117065,relu,1,6.497140195153637e-05,2,256,2,1,COMPLETE
878,878,0.6624635815620422,2023-05-18 18:53:44.045666,2023-05-18 18:53:50.968960,0 days 00:00:06.923294,sigmoid,1,0.00024278030488867347,2,256,2,1,COMPLETE
879,879,0.6626502633094787,2023-05-18 18:53:50.970305,2023-05-18 18:53:57.907740,0 days 00:00:06.937435,sigmoid,1,0.0003416208000241512,2,256,2,1,COMPLETE
880,880,0.692494559288025,2023-05-18 18:53:57.909081,2023-05-18 18:54:05.021412,0 days 00:00:07.112331,sigmoid,1,0.04186028161363539,2,256,2,1,COMPLETE
881,881,0.7140902042388916,2023-05-18 18:54:05.022757,2023-05-18 18:54:12.181280,0 days 00:00:07.158523,sigmoid,1,1.0118596674476194e-05,2,128,2,0,COMPLETE
882,882,0.751279866695404,2023-05-18 18:54:12.182471,2023-05-18 18:54:19.993774,0 days 00:00:07.811303,elu,1,0.046725447701795715,2,256,2,1,COMPLETE
883,883,0.8417693018913269,2023-05-18 18:54:19.995271,2023-05-18 18:54:32.970417,0 days 00:00:12.975146,gelu,1,0.00010575450256876065,8,256,2,1,COMPLETE
884,884,0.6625330567359924,2023-05-18 18:54:32.974496,2023-05-18 18:54:40.152402,0 days 00:00:07.177906,sigmoid,1,0.00020511478215545027,2,256,2,1,COMPLETE
885,885,0.6745033144950867,2023-05-18 18:54:40.154794,2023-05-18 18:54:47.143722,0 days 00:00:06.988928,sigmoid,1,0.0009537181749953255,3,256,3,1,COMPLETE
886,886,0.6624552369117737,2023-05-18 18:54:47.144942,2023-05-18 18:54:54.975429,0 days 00:00:07.830487,sigmoid,1,0.00028861017333132007,2,256,2,1,COMPLETE
887,887,0.6640576004981995,2023-05-18 18:54:54.976683,2023-05-18 18:55:02.196640,0 days 00:00:07.219957,sigmoid,1,0.0001441152371246703,2,256,2,0,COMPLETE
888,888,0.6971102476119995,2023-05-18 18:55:02.197853,2023-05-18 18:55:09.294588,0 days 00:00:07.096735,sigmoid,1,0.017109601448337435,2,256,2,1,COMPLETE
889,889,0.6851312160491944,2023-05-18 18:55:09.295793,2023-05-18 18:55:16.162165,0 days 00:00:06.866372,sigmoid,1,5.7805794689377346e-05,2,64,2,1,COMPLETE
890,890,0.6877202153205871,2023-05-18 18:55:16.163401,2023-05-18 18:55:23.083530,0 days 00:00:06.920129,selu,0,0.0005941340928572464,2,256,2,1,COMPLETE
891,891,0.6657304644584656,2023-05-18 18:55:23.084815,2023-05-18 18:55:30.234764,0 days 00:00:07.149949,sigmoid,1,0.00017716000779886815,2,256,0,1,COMPLETE
892,892,0.6641014456748963,2023-05-18 18:55:30.235952,2023-05-18 18:55:37.945729,0 days 00:00:07.709777,sigmoid,1,0.00038029255055246317,2,256,2,0,COMPLETE
893,893,0.719085431098938,2023-05-18 18:55:37.946944,2023-05-18 18:55:45.436154,0 days 00:00:07.489210,sigmoid,1,0.03657273310066731,2,256,2,1,COMPLETE
894,894,0.6902482390403748,2023-05-18 18:55:45.437433,2023-05-18 18:55:52.827362,0 days 00:00:07.389929,sigmoid,1,0.00626729494365226,2,256,2,1,COMPLETE
895,895,0.6639027953147888,2023-05-18 18:55:52.828589,2023-05-18 18:55:59.712052,0 days 00:00:06.883463,sigmoid,1,0.00024881557362707254,2,128,2,1,COMPLETE
896,896,0.6821663737297058,2023-05-18 18:55:59.713279,2023-05-18 18:56:06.635250,0 days 00:00:06.921971,tanh,1,0.00021856702977300044,2,256,2,1,COMPLETE
897,897,0.6638800024986267,2023-05-18 18:56:06.636461,2023-05-18 18:56:13.791952,0 days 00:00:07.155491,sigmoid,1,0.0004904192844812469,3,256,2,0,COMPLETE
898,898,0.6640078067779541,2023-05-18 18:56:13.793109,2023-05-18 18:56:21.570099,0 days 00:00:07.776990,sigmoid,1,0.00030645245734459354,2,256,2,1,COMPLETE
899,899,0.6760224461555481,2023-05-18 18:56:21.571448,2023-05-18 18:56:28.892075,0 days 00:00:07.320627,sigmoid,1,0.001259318852325455,2,256,1,1,COMPLETE
900,900,0.6647018194198608,2023-05-18 18:56:28.893371,2023-05-18 18:56:36.319969,0 days 00:00:07.426598,sigmoid,1,0.00012861901402230183,2,256,2,1,COMPLETE
901,901,0.6653329253196716,2023-05-18 18:56:36.321199,2023-05-18 18:56:43.595410,0 days 00:00:07.274211,sigmoid,1,0.00015979477803008382,2,512,2,1,COMPLETE
902,902,0.6623577237129211,2023-05-18 18:56:43.596753,2023-05-18 18:56:50.864736,0 days 00:00:07.267983,sigmoid,1,0.00019260001411533574,2,256,2,0,COMPLETE
903,903,0.6914486646652221,2023-05-18 18:56:50.866140,2023-05-18 18:56:57.811363,0 days 00:00:06.945223,relu,1,3.0659485701101726e-05,2,512,2,1,COMPLETE
904,904,0.686653733253479,2023-05-18 18:56:57.812556,2023-05-18 18:57:05.549030,0 days 00:00:07.736474,linear,1,0.00024864397610264825,2,256,2,1,COMPLETE
905,905,0.6669934988021851,2023-05-18 18:57:05.550305,2023-05-18 18:57:13.415044,0 days 00:00:07.864739,sigmoid,1,0.0018956955556400986,3,64,2,1,COMPLETE
906,906,0.6630839943885803,2023-05-18 18:57:13.416315,2023-05-18 18:57:20.326430,0 days 00:00:06.910115,sigmoid,1,9.179165024428301e-05,2,512,2,1,COMPLETE
907,907,0.6636499762535095,2023-05-18 18:57:20.327716,2023-05-18 18:57:27.666969,0 days 00:00:07.339253,sigmoid,1,0.00011011106794220346,2,256,2,0,COMPLETE
908,908,0.6680219769477844,2023-05-18 18:57:27.668258,2023-05-18 18:57:34.448642,0 days 00:00:06.780384,sigmoid,1,1.926768221051815e-05,2,512,2,1,COMPLETE
909,909,0.701480221748352,2023-05-18 18:57:34.449853,2023-05-18 18:57:41.097363,0 days 00:00:06.647510,sigmoid,0,3.889245678586537e-05,2,256,3,1,COMPLETE
910,910,0.6669878244400025,2023-05-18 18:57:41.098549,2023-05-18 18:57:49.288014,0 days 00:00:08.189465,sigmoid,1,0.0003429765498095837,2,512,2,1,COMPLETE
911,911,0.7089643359184266,2023-05-18 18:57:49.289277,2023-05-18 18:57:57.394174,0 days 00:00:08.104897,gelu,1,0.00040640346446112235,2,256,2,1,COMPLETE
912,912,0.6901390433311463,2023-05-18 18:57:57.395403,2023-05-18 18:58:04.630410,0 days 00:00:07.235007,sigmoid,1,0.01718807510880858,2,512,2,0,COMPLETE
913,913,0.6865818619728088,2023-05-18 18:58:04.631682,2023-05-18 18:58:11.876461,0 days 00:00:07.244779,elu,1,0.00014960654423060193,2,256,2,1,COMPLETE
914,914,0.6635076999664307,2023-05-18 18:58:11.877687,2023-05-18 18:58:19.379500,0 days 00:00:07.501813,sigmoid,1,0.0002710020220074123,2,512,2,1,COMPLETE
915,915,0.6629558205604553,2023-05-18 18:58:19.380745,2023-05-18 18:58:27.401935,0 days 00:00:08.021190,sigmoid,1,0.00020505892349432218,2,256,2,1,COMPLETE
916,916,0.6628854036331177,2023-05-18 18:58:27.403310,2023-05-18 18:58:34.656217,0 days 00:00:07.252907,sigmoid,1,0.00012565199874648575,2,512,2,1,COMPLETE
917,917,0.6880755662918091,2023-05-18 18:58:34.657457,2023-05-18 18:58:42.063901,0 days 00:00:07.406444,sigmoid,1,0.003842990275814878,3,128,2,0,COMPLETE
918,918,0.6674828052520752,2023-05-18 18:58:42.065129,2023-05-18 18:58:48.922639,0 days 00:00:06.857510,sigmoid,1,7.839565220284168e-05,2,256,0,1,COMPLETE
919,919,0.6624996304512024,2023-05-18 18:58:48.923872,2023-05-18 18:58:55.924526,0 days 00:00:07.000654,sigmoid,1,0.00017312304364160838,2,512,2,1,COMPLETE
920,920,0.7071222305297852,2023-05-18 18:58:55.925728,2023-05-18 18:59:02.730246,0 days 00:00:06.804518,selu,1,0.0003043796992507562,2,256,2,1,COMPLETE
921,921,0.6706742286682129,2023-05-18 18:59:02.731452,2023-05-18 18:59:11.104547,0 days 00:00:08.373095,sigmoid,1,1.661858277411558e-05,2,512,2,1,COMPLETE
922,922,0.662325131893158,2023-05-18 18:59:11.105801,2023-05-18 18:59:18.581511,0 days 00:00:07.475710,sigmoid,1,0.00023269390450163488,2,256,2,0,COMPLETE
923,923,0.6624258041381836,2023-05-18 18:59:18.582778,2023-05-18 18:59:25.533907,0 days 00:00:06.951129,sigmoid,1,0.00020030835937364828,2,512,2,1,COMPLETE
924,924,0.6695255994796753,2023-05-18 18:59:25.535104,2023-05-18 18:59:32.412347,0 days 00:00:06.877243,sigmoid,1,4.8469707135765816e-05,2,256,2,1,COMPLETE
925,925,0.6813679099082947,2023-05-18 18:59:32.413563,2023-05-18 18:59:39.428912,0 days 00:00:07.015349,sigmoid,1,0.00014708901894598702,2,512,1,1,COMPLETE
926,926,0.668515419960022,2023-05-18 18:59:39.430139,2023-05-18 18:59:46.637414,0 days 00:00:07.207275,sigmoid,1,0.0008204592927416774,2,256,2,1,COMPLETE
927,927,0.8098764538764953,2023-05-18 18:59:46.638617,2023-05-18 18:59:54.547658,0 days 00:00:07.909041,tanh,1,0.06026578970885763,2,512,2,0,COMPLETE
928,928,0.6664731860160827,2023-05-18 18:59:54.549040,2023-05-18 19:00:01.808899,0 days 00:00:07.259859,sigmoid,0,0.0006461367630254477,2,256,2,1,COMPLETE
929,929,0.6688514590263367,2023-05-18 19:00:01.810160,2023-05-18 19:00:10.190148,0 days 00:00:08.379988,sigmoid,1,0.0003701852567188965,2,512,2,1,COMPLETE
930,930,0.6821426630020142,2023-05-18 19:00:10.191379,2023-05-18 19:00:17.068624,0 days 00:00:06.877245,linear,1,0.0002888836421342148,2,64,2,1,COMPLETE
931,931,0.6627210021018982,2023-05-18 19:00:17.069849,2023-05-18 19:00:24.114762,0 days 00:00:07.044913,sigmoid,1,0.00023776998337424182,2,256,2,1,COMPLETE
932,932,0.663152539730072,2023-05-18 19:00:24.116004,2023-05-18 19:00:30.997907,0 days 00:00:06.881903,sigmoid,1,0.00017565474497074159,2,512,2,0,COMPLETE
933,933,0.6741530895233154,2023-05-18 19:00:30.999126,2023-05-18 19:00:38.907284,0 days 00:00:07.908158,relu,1,0.06627263060403807,3,256,2,1,COMPLETE
934,934,0.6634954690933228,2023-05-18 19:00:38.908567,2023-05-18 19:00:46.706090,0 days 00:00:07.797523,sigmoid,1,0.00010293979326329949,2,512,2,1,COMPLETE
935,935,0.6795843243598938,2023-05-18 19:00:46.707513,2023-05-18 19:00:54.688430,0 days 00:00:07.980917,sigmoid,1,0.07384838087403646,6,256,3,1,COMPLETE
936,936,0.6697157025337219,2023-05-18 19:00:54.689653,2023-05-18 19:01:01.517883,0 days 00:00:06.828230,sigmoid,1,0.0004969374291693936,2,512,2,1,COMPLETE
937,937,0.6695504784584045,2023-05-18 19:01:01.519122,2023-05-18 19:01:08.867622,0 days 00:00:07.348500,sigmoid,1,0.0001298413486070347,4,256,2,1,COMPLETE
938,938,0.6745948791503906,2023-05-18 19:01:08.869097,2023-05-18 19:01:16.511252,0 days 00:00:07.642155,sigmoid,1,0.0015695836931596012,2,256,2,0,COMPLETE
939,939,0.6639419317245483,2023-05-18 19:01:16.512521,2023-05-18 19:01:23.854301,0 days 00:00:07.341780,sigmoid,1,0.0003319566314879206,2,128,0,1,COMPLETE
940,940,1.3666059255599976,2023-05-18 19:01:23.855708,2023-05-18 19:01:32.925204,0 days 00:00:09.069496,gelu,1,0.0010992024679442984,3,512,2,1,COMPLETE
941,941,0.6859081864356995,2023-05-18 19:01:32.926431,2023-05-18 19:01:40.161060,0 days 00:00:07.234629,elu,1,0.0002204475940306893,2,256,2,1,COMPLETE
942,942,0.6664443492889405,2023-05-18 19:01:40.162462,2023-05-18 19:01:47.475492,0 days 00:00:07.313030,sigmoid,1,0.00042143160821035805,2,512,2,1,COMPLETE
943,943,0.662308931350708,2023-05-18 19:01:47.476844,2023-05-18 19:01:54.634252,0 days 00:00:07.157408,sigmoid,1,0.0001680070439842695,2,256,2,0,COMPLETE
944,944,0.6632604837417603,2023-05-18 19:01:54.636450,2023-05-18 19:02:02.310429,0 days 00:00:07.673979,sigmoid,1,0.00026218247415935617,2,512,2,1,COMPLETE
945,945,0.6623170495033264,2023-05-18 19:02:02.311741,2023-05-18 19:02:09.808170,0 days 00:00:07.496429,sigmoid,1,0.00019539541281994282,2,256,2,1,COMPLETE
946,946,0.6659807085990905,2023-05-18 19:02:09.809414,2023-05-18 19:02:16.916964,0 days 00:00:07.107550,sigmoid,1,0.0002901747705784599,2,512,2,1,COMPLETE
947,947,0.698172414302826,2023-05-18 19:02:16.918196,2023-05-18 19:02:24.139695,0 days 00:00:07.221499,sigmoid,0,0.00014510449771532857,2,256,1,1,COMPLETE
948,948,0.7050623178482056,2023-05-18 19:02:24.140978,2023-05-18 19:02:30.983001,0 days 00:00:06.842023,selu,1,0.00011501055232851436,2,512,2,0,COMPLETE
949,949,0.6666504859924316,2023-05-18 19:02:30.984472,2023-05-18 19:02:38.135036,0 days 00:00:07.150564,sigmoid,1,6.184255192934678e-05,2,256,2,1,COMPLETE
950,950,0.6678291320800781,2023-05-18 19:02:38.136330,2023-05-18 19:02:45.813322,0 days 00:00:07.676992,sigmoid,1,0.00023287213632162357,2,512,2,1,COMPLETE
951,951,0.6665763974189758,2023-05-18 19:02:45.814574,2023-05-18 19:02:53.361532,0 days 00:00:07.546958,sigmoid,1,0.0007412077673950045,2,256,2,1,COMPLETE
952,952,0.6739924430847168,2023-05-18 19:02:53.362801,2023-05-18 19:03:00.710707,0 days 00:00:07.347906,sigmoid,1,0.002106774139847746,2,512,2,1,COMPLETE
953,953,0.7006134510040283,2023-05-18 19:03:00.711944,2023-05-18 19:03:07.676920,0 days 00:00:06.964976,sigmoid,1,1.1305449697255365e-05,2,256,2,0,COMPLETE
954,954,0.6973950266838074,2023-05-18 19:03:07.678162,2023-05-18 19:03:14.761077,0 days 00:00:07.082915,tanh,1,0.0967293906093952,3,64,2,1,COMPLETE
955,955,0.6767599821090698,2023-05-18 19:03:14.762323,2023-05-18 19:03:21.545605,0 days 00:00:06.783282,sigmoid,1,0.0026989318620765897,2,512,2,1,COMPLETE
956,956,0.6640371561050415,2023-05-18 19:03:21.546792,2023-05-18 19:03:29.230180,0 days 00:00:07.683388,sigmoid,1,0.0003512478911890433,2,256,2,1,COMPLETE
957,957,0.6630050539970398,2023-05-18 19:03:29.231578,2023-05-18 19:03:36.399159,0 days 00:00:07.167581,sigmoid,1,0.00018636081711254467,2,512,2,1,COMPLETE
958,958,0.678359055519104,2023-05-18 19:03:36.400654,2023-05-18 19:03:43.651525,0 days 00:00:07.250871,sigmoid,1,0.00027418307069507913,2,256,3,0,COMPLETE
959,959,0.6870607852935791,2023-05-18 19:03:43.652966,2023-05-18 19:03:50.917883,0 days 00:00:07.264917,linear,1,0.00015519828968835333,2,512,2,1,COMPLETE
960,960,0.665148651599884,2023-05-18 19:03:50.919122,2023-05-18 19:03:57.728132,0 days 00:00:06.809010,sigmoid,1,0.0005333815578535061,2,256,2,1,COMPLETE
961,961,0.6643769264221191,2023-05-18 19:03:57.729370,2023-05-18 19:04:05.219207,0 days 00:00:07.489837,sigmoid,1,0.0001021800904305219,3,512,2,1,COMPLETE
962,962,0.6999147415161133,2023-05-18 19:04:05.220415,2023-05-18 19:04:13.141408,0 days 00:00:07.920993,sigmoid,1,0.017784144167781842,2,256,2,1,COMPLETE
963,963,0.681029486656189,2023-05-18 19:04:13.142679,2023-05-18 19:04:20.115345,0 days 00:00:06.972666,sigmoid,1,1.4167062521855984e-05,2,128,0,0,COMPLETE
964,964,0.6919452905654907,2023-05-18 19:04:20.116733,2023-05-18 19:04:28.029304,0 days 00:00:07.912571,relu,1,2.2980553513251482e-05,2,512,2,1,COMPLETE
965,965,0.6656668543815613,2023-05-18 19:04:28.030546,2023-05-18 19:04:35.071823,0 days 00:00:07.041277,sigmoid,1,8.564316061364218e-05,2,256,2,1,COMPLETE
966,966,0.6746002554893493,2023-05-18 19:04:35.073203,2023-05-18 19:04:42.379777,0 days 00:00:07.306574,sigmoid,0,0.00044032569466230385,2,512,2,1,COMPLETE
967,967,0.68690025806427,2023-05-18 19:04:42.381139,2023-05-18 19:04:49.260826,0 days 00:00:06.879687,sigmoid,1,0.003353216198519976,2,256,2,1,COMPLETE
968,968,0.6623247981071472,2023-05-18 19:04:49.262004,2023-05-18 19:04:57.125152,0 days 00:00:07.863148,sigmoid,1,0.00022364795288692355,2,256,2,0,COMPLETE
969,969,0.7385404825210571,2023-05-18 19:04:57.126510,2023-05-18 19:05:04.339635,0 days 00:00:07.213125,elu,1,0.024232700065276388,2,512,2,1,COMPLETE
970,970,0.663841712474823,2023-05-18 19:05:04.340930,2023-05-18 19:05:11.530182,0 days 00:00:07.189252,sigmoid,1,0.0001302731089565733,2,256,2,1,COMPLETE
971,971,0.7452096819877625,2023-05-18 19:05:11.531661,2023-05-18 19:05:18.983329,0 days 00:00:07.451668,gelu,1,0.0003208833952166827,2,512,1,1,COMPLETE
972,972,0.7226881623268128,2023-05-18 19:05:18.984579,2023-05-18 19:05:26.075855,0 days 00:00:07.091276,sigmoid,1,0.010608149124148288,3,256,2,1,COMPLETE
973,973,0.6710901021957397,2023-05-18 19:05:26.077289,2023-05-18 19:05:33.290326,0 days 00:00:07.213037,sigmoid,1,1.1699722047259378e-05,2,512,2,0,COMPLETE
974,974,0.663292121887207,2023-05-18 19:05:33.291552,2023-05-18 19:05:41.166728,0 days 00:00:07.875176,sigmoid,1,0.0001827291066768064,2,256,2,1,COMPLETE
975,975,0.6630857586860657,2023-05-18 19:05:41.168023,2023-05-18 19:05:48.420699,0 days 00:00:07.252676,sigmoid,1,0.00025498139928915886,2,512,2,1,COMPLETE
976,976,0.7050471067428589,2023-05-18 19:05:48.421953,2023-05-18 19:05:55.486217,0 days 00:00:07.064264,sigmoid,1,0.03138404956120388,2,256,2,1,COMPLETE
977,977,0.7605848431587219,2023-05-18 19:05:55.487490,2023-05-18 19:06:02.759234,0 days 00:00:07.271744,selu,1,0.01998079964881496,2,512,2,1,COMPLETE
978,978,0.6633288502693176,2023-05-18 19:06:02.760648,2023-05-18 19:06:09.849888,0 days 00:00:07.089240,sigmoid,1,0.0003756920572686235,2,256,2,0,COMPLETE
979,979,0.6829932570457459,2023-05-18 19:06:09.851140,2023-05-18 19:06:17.319426,0 days 00:00:07.468286,sigmoid,1,2.9160556108147977e-05,2,64,2,1,COMPLETE
980,980,0.6743268251419068,2023-05-18 19:06:17.320758,2023-05-18 19:06:27.705613,0 days 00:00:10.384855,sigmoid,1,2.00167007734104e-05,9,512,2,1,COMPLETE
981,981,0.6697301149368287,2023-05-18 19:06:27.706900,2023-05-18 19:06:35.008582,0 days 00:00:07.301682,sigmoid,1,3.505453959814577e-05,2,256,2,1,COMPLETE
982,982,0.6746513485908509,2023-05-18 19:06:35.009806,2023-05-18 19:06:42.755427,0 days 00:00:07.745621,sigmoid,1,0.00016171998019699768,5,512,3,1,COMPLETE
983,983,0.6853739380836487,2023-05-18 19:06:42.756811,2023-05-18 19:06:49.618118,0 days 00:00:06.861307,tanh,1,0.00021278165156134236,2,256,2,0,COMPLETE
984,984,0.6671849608421325,2023-05-18 19:06:49.619539,2023-05-18 19:06:56.699306,0 days 00:00:07.079767,sigmoid,0,0.0001267328444073384,3,512,2,1,COMPLETE
