,number,value,datetime_start,datetime_complete,duration,params_activation,params_hidden_initializer,params_lr,params_n_layers,params_neurons,params_optimizer,params_output_initializer,state
421,421,0.6647223830223083,2023-05-18 17:59:35.339020,2023-05-18 17:59:42.317981,0 days 00:00:06.978961,sigmoid,1,6.452316578699178e-05,2,512,2,1,COMPLETE
422,422,0.6848956346511841,2023-05-18 17:59:42.319004,2023-05-18 17:59:49.427297,0 days 00:00:07.108293,tanh,1,0.00020191086696448463,2,256,2,1,COMPLETE
423,423,0.6629477381706238,2023-05-18 17:59:49.428756,2023-05-18 17:59:56.284074,0 days 00:00:06.855318,sigmoid,1,0.0001528278954727659,2,512,2,1,COMPLETE
424,424,0.663115119934082,2023-05-18 17:59:56.285216,2023-05-18 18:00:02.490538,0 days 00:00:06.205322,sigmoid,1,0.00010041497625209475,2,512,2,1,COMPLETE
425,425,0.6638734817504883,2023-05-18 18:00:02.492694,2023-05-18 18:00:08.666520,0 days 00:00:06.173826,sigmoid,1,0.00013192977130021944,2,512,2,1,COMPLETE
426,426,0.6632900834083557,2023-05-18 18:00:08.667526,2023-05-18 18:00:15.331432,0 days 00:00:06.663906,sigmoid,1,0.00022677599764414123,2,512,2,1,COMPLETE
427,427,0.691333270072937,2023-05-18 18:00:15.332463,2023-05-18 18:00:21.554623,0 days 00:00:06.222160,linear,1,0.00016701810538691133,2,512,2,0,COMPLETE
428,428,0.6646571755409241,2023-05-18 18:00:21.555681,2023-05-18 18:00:28.852159,0 days 00:00:07.296478,sigmoid,0,0.000317065547492337,2,64,2,1,COMPLETE
429,429,0.6747198343276978,2023-05-18 18:00:28.853344,2023-05-18 18:00:37.606447,0 days 00:00:08.753103,sigmoid,1,0.011375548993877584,9,512,1,1,COMPLETE
430,430,0.6638934016227722,2023-05-18 18:00:37.607497,2023-05-18 18:00:44.278469,0 days 00:00:06.670972,sigmoid,1,8.245995158127214e-05,2,512,2,1,COMPLETE
431,431,0.7896950006484985,2023-05-18 18:00:44.279546,2023-05-18 18:00:50.744241,0 days 00:00:06.464695,relu,1,0.004821112769215001,2,512,2,1,COMPLETE
432,432,0.6635226011276245,2023-05-18 18:00:50.745272,2023-05-18 18:00:57.246525,0 days 00:00:06.501253,sigmoid,1,0.00011379315600080795,2,512,2,1,COMPLETE
433,433,0.6634239435195923,2023-05-18 18:00:57.247593,2023-05-18 18:01:04.110806,0 days 00:00:06.863213,sigmoid,1,0.00014307341432282598,2,512,2,1,COMPLETE
434,434,0.6631951570510864,2023-05-18 18:01:04.111958,2023-05-18 18:01:10.355690,0 days 00:00:06.243732,sigmoid,1,0.000182141833637628,2,512,2,1,COMPLETE
435,435,0.7055686950683594,2023-05-18 18:01:10.356731,2023-05-18 18:01:17.092819,0 days 00:00:06.736088,elu,1,0.00024348159219543888,2,512,2,1,COMPLETE
436,436,0.6748818635940552,2023-05-18 18:01:17.093835,2023-05-18 18:01:26.178197,0 days 00:00:09.084362,sigmoid,1,0.0001291568109174916,10,512,2,1,COMPLETE
437,437,0.7017619967460632,2023-05-18 18:01:26.179223,2023-05-18 18:01:33.249235,0 days 00:00:07.070012,gelu,1,0.0001968191568459191,2,512,2,1,COMPLETE
438,438,0.6666569590568543,2023-05-18 18:01:33.250245,2023-05-18 18:01:40.551757,0 days 00:00:07.301512,sigmoid,1,0.00010313064829902915,2,128,2,1,COMPLETE
439,439,0.6621452212333679,2023-05-18 18:01:40.552841,2023-05-18 18:01:46.840601,0 days 00:00:06.287760,sigmoid,1,0.00015722104731176887,2,512,2,0,COMPLETE
440,440,0.6924257874488831,2023-05-18 18:01:46.841855,2023-05-18 18:01:52.818516,0 days 00:00:05.976661,sigmoid,1,0.000156962786174721,2,512,3,0,COMPLETE
441,441,0.6668280243873597,2023-05-18 18:01:52.819573,2023-05-18 18:01:59.380366,0 days 00:00:06.560793,sigmoid,1,0.0003858022847371065,2,512,2,0,COMPLETE
442,442,0.6653938531875611,2023-05-18 18:01:59.383837,2023-05-18 18:02:05.706939,0 days 00:00:06.323102,sigmoid,1,0.00019769352046896361,3,512,2,0,COMPLETE
443,443,0.6685287833213807,2023-05-18 18:02:05.708096,2023-05-18 18:02:12.562633,0 days 00:00:06.854537,sigmoid,1,0.0008079879188122232,2,512,2,0,COMPLETE
444,444,0.6648036360740661,2023-05-18 18:02:12.563712,2023-05-18 18:02:18.907414,0 days 00:00:06.343702,sigmoid,1,0.0002584093297431588,2,512,2,0,COMPLETE
445,445,0.6708776593208313,2023-05-18 18:02:18.908488,2023-05-18 18:02:25.227650,0 days 00:00:06.319162,sigmoid,1,1.0719628599538231e-05,2,512,0,0,COMPLETE
446,446,0.6776564240455627,2023-05-18 18:02:25.228684,2023-05-18 18:02:31.856619,0 days 00:00:06.627935,selu,0,0.00016772400925141938,2,256,2,1,COMPLETE
447,447,0.6804535150527954,2023-05-18 18:02:31.857950,2023-05-18 18:02:37.929239,0 days 00:00:06.071289,sigmoid,1,0.0013545320759219379,2,512,2,0,COMPLETE
448,448,0.6628534436225891,2023-05-18 18:02:37.930245,2023-05-18 18:02:44.575921,0 days 00:00:06.645676,sigmoid,1,0.0001432420943943514,2,512,2,0,COMPLETE
449,449,0.6677873253822326,2023-05-18 18:02:44.577001,2023-05-18 18:02:52.606494,0 days 00:00:08.029493,sigmoid,1,0.0002125643346437233,6,512,2,0,COMPLETE
450,450,0.6814668655395508,2023-05-18 18:02:52.607547,2023-05-18 18:02:59.291601,0 days 00:00:06.684054,sigmoid,1,0.0031025270289102755,2,512,2,0,COMPLETE
451,451,0.6662789821624756,2023-05-18 18:02:59.292695,2023-05-18 18:03:05.355927,0 days 00:00:06.063232,sigmoid,1,0.00044412419004750844,2,512,2,1,COMPLETE
452,452,0.6872133255004883,2023-05-18 18:03:05.356928,2023-05-18 18:03:11.857406,0 days 00:00:06.500478,tanh,1,0.00016940132752367353,2,512,2,1,COMPLETE
453,453,0.6644894361495972,2023-05-18 18:03:11.858432,2023-05-18 18:03:18.364780,0 days 00:00:06.506348,sigmoid,1,0.00031862350725924495,2,64,2,1,COMPLETE
454,454,0.7113363742828369,2023-05-18 18:03:18.368262,2023-05-18 18:03:26.085191,0 days 00:00:07.716929,sigmoid,1,0.00012838968556262256,2,512,1,1,COMPLETE
455,455,0.6644689917564393,2023-05-18 18:03:26.086240,2023-05-18 18:03:32.342931,0 days 00:00:06.256691,sigmoid,1,0.00022948293756969396,2,512,2,1,COMPLETE
456,456,0.6635027408599854,2023-05-18 18:03:32.343998,2023-05-18 18:03:38.550422,0 days 00:00:06.206424,sigmoid,1,0.00016231527296677525,2,512,2,1,COMPLETE
457,457,0.7118260025978088,2023-05-18 18:03:38.551456,2023-05-18 18:03:44.833165,0 days 00:00:06.281709,linear,1,0.0010632059610654072,3,512,2,1,COMPLETE
458,458,0.6641522645950317,2023-05-18 18:03:44.834191,2023-05-18 18:03:50.934231,0 days 00:00:06.100040,sigmoid,1,0.00018910472496922937,2,512,2,0,COMPLETE
459,459,0.6903297185897828,2023-05-18 18:03:50.935251,2023-05-18 18:03:58.582074,0 days 00:00:07.646823,relu,1,0.00012248780878591948,2,512,2,1,COMPLETE
460,460,0.6626067161560059,2023-05-18 18:03:58.583346,2023-05-18 18:04:05.047490,0 days 00:00:06.464144,sigmoid,1,0.000271758217223953,2,512,2,1,COMPLETE
461,461,0.662566351890564,2023-05-18 18:04:05.048604,2023-05-18 18:04:11.285339,0 days 00:00:06.236735,sigmoid,1,0.00014728995306213395,2,512,2,1,COMPLETE
462,462,0.6634569287300109,2023-05-18 18:04:11.287485,2023-05-18 18:04:17.353546,0 days 00:00:06.066061,sigmoid,1,0.00010048055571051087,2,512,2,1,COMPLETE
463,463,0.6656416893005371,2023-05-18 18:04:17.354565,2023-05-18 18:04:23.537562,0 days 00:00:06.182997,sigmoid,1,0.00014200899355874626,2,128,2,1,COMPLETE
464,464,0.6623300313949585,2023-05-18 18:04:23.538578,2023-05-18 18:04:29.587421,0 days 00:00:06.048843,sigmoid,1,0.00012214473776731488,2,512,2,1,COMPLETE
465,465,0.8666333436965943,2023-05-18 18:04:29.588452,2023-05-18 18:04:38.874555,0 days 00:00:09.286103,elu,1,7.121479580804225e-05,8,512,2,1,COMPLETE
466,466,0.6679605722427369,2023-05-18 18:04:38.875619,2023-05-18 18:04:45.889444,0 days 00:00:07.013825,sigmoid,0,8.574807276496394e-05,3,512,2,1,COMPLETE
467,467,0.6925647377967834,2023-05-18 18:04:45.890515,2023-05-18 18:04:52.574993,0 days 00:00:06.684478,gelu,1,0.00011188629192704321,2,512,2,1,COMPLETE
468,468,0.6629975080490113,2023-05-18 18:04:52.576039,2023-05-18 18:04:59.132829,0 days 00:00:06.556790,sigmoid,1,0.0001332508357467607,2,512,2,0,COMPLETE
469,469,0.7370208740234375,2023-05-18 18:04:59.133995,2023-05-18 18:05:06.060369,0 days 00:00:06.926374,sigmoid,1,1.4237774305024982e-05,2,512,3,1,COMPLETE
470,470,0.6699668765068054,2023-05-18 18:05:06.061495,2023-05-18 18:05:12.896623,0 days 00:00:06.835128,sigmoid,1,9.692903886235488e-05,2,512,0,1,COMPLETE
471,471,0.6860580563545227,2023-05-18 18:05:12.897679,2023-05-18 18:05:19.159808,0 days 00:00:06.262129,sigmoid,1,0.004482958020858036,2,256,2,1,COMPLETE
472,472,0.6651768565177918,2023-05-18 18:05:19.160896,2023-05-18 18:05:25.407207,0 days 00:00:06.246311,sigmoid,1,0.00011245718707609287,2,512,2,1,COMPLETE
473,473,0.6832489252090455,2023-05-18 18:05:25.408264,2023-05-18 18:05:31.967542,0 days 00:00:06.559278,sigmoid,1,0.06399922110989284,2,512,2,1,COMPLETE
474,474,0.6683005452156067,2023-05-18 18:05:31.968600,2023-05-18 18:05:38.816192,0 days 00:00:06.847592,sigmoid,1,3.787307260853776e-05,3,512,2,1,COMPLETE
475,475,0.6644979596138001,2023-05-18 18:05:38.817265,2023-05-18 18:05:47.000535,0 days 00:00:08.183270,sigmoid,1,6.070420551325286e-05,2,512,2,1,COMPLETE
476,476,0.7098014950752258,2023-05-18 18:05:47.001786,2023-05-18 18:05:53.831254,0 days 00:00:06.829468,selu,1,0.00014354992272813628,2,512,2,1,COMPLETE
477,477,0.6653298616409302,2023-05-18 18:05:53.832320,2023-05-18 18:06:00.055174,0 days 00:00:06.222854,sigmoid,1,5.329688027317266e-05,2,512,2,0,COMPLETE
478,478,0.6683601498603821,2023-05-18 18:06:00.056239,2023-05-18 18:06:06.101982,0 days 00:00:06.045743,sigmoid,1,0.0001615866750887558,2,64,2,1,COMPLETE
479,479,0.6940636277198792,2023-05-18 18:06:06.104079,2023-05-18 18:06:11.966312,0 days 00:00:05.862233,sigmoid,1,0.00012342381424225665,2,512,1,1,COMPLETE
480,480,0.6634573340415955,2023-05-18 18:06:11.967348,2023-05-18 18:06:20.040151,0 days 00:00:08.072803,sigmoid,1,8.367650201075973e-05,2,512,2,1,COMPLETE
481,481,0.6806877017021179,2023-05-18 18:06:20.044174,2023-05-18 18:06:26.495678,0 days 00:00:06.451504,sigmoid,1,0.0021638431397398863,2,512,2,1,COMPLETE
482,482,0.6911795973777771,2023-05-18 18:06:26.496757,2023-05-18 18:06:33.617473,0 days 00:00:07.120716,tanh,1,0.0001562617752227878,2,512,2,1,COMPLETE
483,483,0.6628167390823364,2023-05-18 18:06:33.618544,2023-05-18 18:06:39.750408,0 days 00:00:06.131864,sigmoid,1,0.00012088200537660991,2,512,2,1,COMPLETE
484,484,0.6638466238975524,2023-05-18 18:06:39.751472,2023-05-18 18:06:46.231147,0 days 00:00:06.479675,sigmoid,1,0.00018157312166085942,2,512,2,1,COMPLETE
485,485,0.6679799675941467,2023-05-18 18:06:46.232354,2023-05-18 18:06:52.296337,0 days 00:00:06.063983,sigmoid,1,0.0005269539544238763,2,512,2,0,COMPLETE
486,486,0.6630065202713012,2023-05-18 18:06:52.297344,2023-05-18 18:06:59.571161,0 days 00:00:07.273817,sigmoid,0,0.00013964418284903677,2,512,2,1,COMPLETE
487,487,0.6738190054893494,2023-05-18 18:06:59.572274,2023-05-18 18:07:06.774281,0 days 00:00:07.202007,linear,1,0.03883180467596427,2,128,2,1,COMPLETE
488,488,0.6629952907562255,2023-05-18 18:07:06.775354,2023-05-18 18:07:12.977204,0 days 00:00:06.201850,sigmoid,1,0.0001127504372097154,2,512,2,1,COMPLETE
489,489,0.6885010480880738,2023-05-18 18:07:12.978286,2023-05-18 18:07:19.597114,0 days 00:00:06.618828,relu,1,9.52531940987858e-05,2,512,2,1,COMPLETE
490,490,0.6749600887298584,2023-05-18 18:07:19.598169,2023-05-18 18:07:25.548576,0 days 00:00:05.950407,sigmoid,1,0.000685837966789205,2,512,3,1,COMPLETE
491,491,0.6620332717895507,2023-05-18 18:07:25.549600,2023-05-18 18:07:32.199505,0 days 00:00:06.649905,sigmoid,1,0.00017851802110130672,2,512,2,1,COMPLETE
492,492,0.664829432964325,2023-05-18 18:07:32.200678,2023-05-18 18:07:39.400033,0 days 00:00:07.199355,sigmoid,1,0.00020378094613533767,3,512,2,1,COMPLETE
493,493,0.6640411138534545,2023-05-18 18:07:39.401104,2023-05-18 18:07:45.633155,0 days 00:00:06.232051,sigmoid,1,0.0001758812550996936,2,512,2,1,COMPLETE
494,494,0.6653733372688293,2023-05-18 18:07:45.634218,2023-05-18 18:07:52.228066,0 days 00:00:06.593848,sigmoid,1,4.326290201280709e-05,2,512,2,0,COMPLETE
495,495,0.7037240982055664,2023-05-18 18:07:52.229106,2023-05-18 18:07:58.275525,0 days 00:00:06.046419,elu,1,0.00013371472351516388,2,512,0,1,COMPLETE
496,496,0.673307454586029,2023-05-18 18:07:58.276589,2023-05-18 18:08:04.770283,0 days 00:00:06.493694,sigmoid,1,0.0015849545446904687,2,512,2,1,COMPLETE
497,497,0.6891458749771118,2023-05-18 18:08:04.771332,2023-05-18 18:08:12.795942,0 days 00:00:08.024610,gelu,1,7.556026949684574e-05,2,256,2,1,COMPLETE
498,498,0.6629633903503418,2023-05-18 18:08:12.797060,2023-05-18 18:08:19.251836,0 days 00:00:06.454776,sigmoid,1,0.0001971251033727744,2,512,2,1,COMPLETE
499,499,0.6626333117485046,2023-05-18 18:08:19.252931,2023-05-18 18:08:25.564056,0 days 00:00:06.311125,sigmoid,1,0.00015480145132781357,2,512,2,1,COMPLETE
500,500,0.6689747333526611,2023-05-18 18:08:25.565134,2023-05-18 18:08:32.008621,0 days 00:00:06.443487,sigmoid,1,0.0011539923794381894,3,512,2,1,COMPLETE
501,501,0.6644108891487122,2023-05-18 18:08:32.009696,2023-05-18 18:08:38.071780,0 days 00:00:06.062084,sigmoid,1,0.00010052886129100536,2,512,2,1,COMPLETE
502,502,0.66321702003479,2023-05-18 18:08:38.072962,2023-05-18 18:08:44.703173,0 days 00:00:06.630211,sigmoid,1,0.0001269982796427281,2,512,2,0,COMPLETE
503,503,0.6637984037399292,2023-05-18 18:08:44.704308,2023-05-18 18:08:51.106741,0 days 00:00:06.402433,sigmoid,1,0.00017259459817555128,2,512,2,1,COMPLETE
504,504,0.7899601221084595,2023-05-18 18:08:51.107896,2023-05-18 18:08:57.742003,0 days 00:00:06.634107,sigmoid,0,1.6675798854059826e-05,2,64,2,1,COMPLETE
505,505,0.662800395488739,2023-05-18 18:08:57.743292,2023-05-18 18:09:03.869024,0 days 00:00:06.125732,sigmoid,1,0.0002289782456301462,2,512,2,1,COMPLETE
506,506,1.0302738547325134,2023-05-18 18:09:03.870244,2023-05-18 18:09:10.702978,0 days 00:00:06.832734,selu,1,0.00014725420365450275,5,512,1,1,COMPLETE
507,507,0.6661710977554322,2023-05-18 18:09:10.704082,2023-05-18 18:09:17.702502,0 days 00:00:06.998420,sigmoid,1,5.22067962339845e-05,2,512,2,1,COMPLETE
508,508,0.6627662420272827,2023-05-18 18:09:17.703566,2023-05-18 18:09:25.167429,0 days 00:00:07.463863,sigmoid,1,0.00011464176501227158,2,512,2,1,COMPLETE
509,509,0.6751432061195374,2023-05-18 18:09:25.168532,2023-05-18 18:09:31.461593,0 days 00:00:06.293061,sigmoid,1,0.024788815453084232,2,512,2,1,COMPLETE
510,510,0.6676822543144226,2023-05-18 18:09:31.462663,2023-05-18 18:09:37.713106,0 days 00:00:06.250443,sigmoid,1,3.133906215191396e-05,2,512,2,0,COMPLETE
511,511,0.6622392416000367,2023-05-18 18:09:37.714183,2023-05-18 18:09:43.860158,0 days 00:00:06.145975,sigmoid,1,0.00019879721654403443,2,512,2,1,COMPLETE
512,512,0.7498598575592041,2023-05-18 18:09:43.861457,2023-05-18 18:09:49.951744,0 days 00:00:06.090287,tanh,1,0.002211257951820132,2,128,2,1,COMPLETE
513,513,0.6686944365501404,2023-05-18 18:09:49.952776,2023-05-18 18:09:56.732287,0 days 00:00:06.779511,sigmoid,1,1.7990529178652973e-05,2,512,2,1,COMPLETE
514,514,0.6786987662315369,2023-05-18 18:09:56.733543,2023-05-18 18:10:03.651129,0 days 00:00:06.917586,sigmoid,1,0.01517208044644378,2,512,2,1,COMPLETE
515,515,0.6771147727966309,2023-05-18 18:10:03.652350,2023-05-18 18:10:10.386498,0 days 00:00:06.734148,sigmoid,1,0.00020641697560927304,3,512,3,1,COMPLETE
516,516,0.6752818703651429,2023-05-18 18:10:10.387612,2023-05-18 18:10:17.429891,0 days 00:00:07.042279,sigmoid,1,0.005697431128458274,2,512,2,1,COMPLETE
517,517,0.6687432646751403,2023-05-18 18:10:17.431109,2023-05-18 18:10:24.072069,0 days 00:00:06.640960,sigmoid,1,0.0003402531949838756,2,512,2,1,COMPLETE
518,518,0.6705075144767761,2023-05-18 18:10:24.073118,2023-05-18 18:10:31.285945,0 days 00:00:07.212827,sigmoid,1,2.830270333663588e-05,3,512,2,0,COMPLETE
519,519,0.7570934176445008,2023-05-18 18:10:31.287015,2023-05-18 18:10:40.288918,0 days 00:00:09.001903,linear,1,0.00026811952564813704,7,512,2,1,COMPLETE
520,520,0.6978982090950012,2023-05-18 18:10:40.289997,2023-05-18 18:10:46.590497,0 days 00:00:06.300500,relu,1,0.00017539584673859955,2,512,2,1,COMPLETE
521,521,0.6737225174903869,2023-05-18 18:10:46.591560,2023-05-18 18:10:53.414777,0 days 00:00:06.823217,sigmoid,1,3.153084360432561e-05,4,512,0,1,COMPLETE
522,522,0.6623781204223633,2023-05-18 18:10:53.415877,2023-05-18 18:10:59.490267,0 days 00:00:06.074390,sigmoid,1,0.00022615629612296267,2,256,2,1,COMPLETE
523,523,0.66181321144104,2023-05-18 18:10:59.491449,2023-05-18 18:11:05.533816,0 days 00:00:06.042367,sigmoid,1,0.0002946797713028149,2,256,2,1,COMPLETE
524,524,0.6632888913154602,2023-05-18 18:11:05.534861,2023-05-18 18:11:12.404423,0 days 00:00:06.869562,sigmoid,0,0.0002700008027387786,2,256,2,1,COMPLETE
525,525,0.7089306354522705,2023-05-18 18:11:12.405535,2023-05-18 18:11:19.175582,0 days 00:00:06.770047,elu,1,0.07849763920474395,2,256,2,1,COMPLETE
526,526,0.6628587722778321,2023-05-18 18:11:19.179453,2023-05-18 18:11:25.466782,0 days 00:00:06.287329,sigmoid,1,0.00031804463320904674,2,256,2,1,COMPLETE
527,527,0.6920698523521424,2023-05-18 18:11:25.467988,2023-05-18 18:11:32.284802,0 days 00:00:06.816814,gelu,1,0.0002270935898741038,2,256,2,0,COMPLETE
528,528,0.6634605288505554,2023-05-18 18:11:32.285989,2023-05-18 18:11:38.379626,0 days 00:00:06.093637,sigmoid,1,0.00042248947112420677,2,256,2,1,COMPLETE
529,529,0.662640643119812,2023-05-18 18:11:38.380686,2023-05-18 18:11:46.014516,0 days 00:00:07.633830,sigmoid,1,0.0002263274042478634,2,256,2,1,COMPLETE
530,530,0.6626186847686768,2023-05-18 18:11:46.015650,2023-05-18 18:11:53.292755,0 days 00:00:07.277105,sigmoid,1,0.0002771914618707543,2,256,2,1,COMPLETE
531,531,0.7149853110313416,2023-05-18 18:11:53.293848,2023-05-18 18:12:00.040235,0 days 00:00:06.746387,sigmoid,1,0.00019731781456733215,3,256,1,1,COMPLETE
532,532,0.6898323774337769,2023-05-18 18:12:00.041476,2023-05-18 18:12:06.234554,0 days 00:00:06.193078,sigmoid,1,0.007911275690493448,2,256,2,1,COMPLETE
533,533,0.6652811527252197,2023-05-18 18:12:06.235647,2023-05-18 18:12:12.343256,0 days 00:00:06.107609,sigmoid,1,0.0007707563684012747,2,256,2,1,COMPLETE
534,534,0.7279208421707153,2023-05-18 18:12:12.344450,2023-05-18 18:12:18.380710,0 days 00:00:06.036260,sigmoid,1,0.016244832874340785,2,256,2,1,COMPLETE
535,535,0.703508460521698,2023-05-18 18:12:18.381747,2023-05-18 18:12:26.350427,0 days 00:00:07.968680,selu,1,0.0002345895179205245,2,256,2,0,COMPLETE
536,536,0.6631469011306763,2023-05-18 18:12:26.351536,2023-05-18 18:12:33.170401,0 days 00:00:06.818865,sigmoid,1,0.00030404851027274725,2,256,2,1,COMPLETE
537,537,0.690381896495819,2023-05-18 18:12:33.171563,2023-05-18 18:12:39.412614,0 days 00:00:06.241051,sigmoid,1,0.03595356890618527,2,256,2,1,COMPLETE
538,538,0.662872064113617,2023-05-18 18:12:39.413670,2023-05-18 18:12:45.977101,0 days 00:00:06.563431,sigmoid,1,0.00019228478422032714,2,256,2,1,COMPLETE
539,539,0.6631282091140747,2023-05-18 18:12:45.978364,2023-05-18 18:12:51.996227,0 days 00:00:06.017863,sigmoid,1,0.0003569182372937356,2,256,2,1,COMPLETE
540,540,0.6625210642814636,2023-05-18 18:12:51.997269,2023-05-18 18:12:58.640703,0 days 00:00:06.643434,sigmoid,1,0.0001869274601656087,2,256,2,1,COMPLETE
541,541,0.6819170117378235,2023-05-18 18:12:58.641968,2023-05-18 18:13:06.006456,0 days 00:00:07.364488,sigmoid,1,0.00024281705985424755,2,64,3,1,COMPLETE
542,542,0.6828650712966919,2023-05-18 18:13:06.007629,2023-05-18 18:13:12.789527,0 days 00:00:06.781898,tanh,1,0.00018299237156687561,2,512,2,1,COMPLETE
543,543,0.663759982585907,2023-05-18 18:13:12.790612,2023-05-18 18:13:19.911207,0 days 00:00:07.120595,sigmoid,0,0.0002227349860027459,2,256,2,0,COMPLETE
544,544,0.6689578533172608,2023-05-18 18:13:19.912448,2023-05-18 18:13:26.558105,0 days 00:00:06.645657,sigmoid,1,0.004262913693694886,2,256,0,1,COMPLETE
545,545,0.6629587173461914,2023-05-18 18:13:26.559159,2023-05-18 18:13:33.173933,0 days 00:00:06.614774,sigmoid,1,0.0005265972219542143,2,128,2,1,COMPLETE
546,546,0.6808930277824402,2023-05-18 18:13:33.174992,2023-05-18 18:13:40.659641,0 days 00:00:07.484649,linear,1,0.00017038064508221245,3,256,2,1,COMPLETE
547,547,0.6628500699996949,2023-05-18 18:13:40.660933,2023-05-18 18:13:47.715540,0 days 00:00:07.054607,sigmoid,1,0.00012862698880750572,2,512,2,1,COMPLETE
548,548,0.6639965534210205,2023-05-18 18:13:47.716788,2023-05-18 18:13:54.932582,0 days 00:00:07.215794,sigmoid,1,0.0002896225773715703,2,512,2,1,COMPLETE
549,549,0.967359745502472,2023-05-18 18:13:54.933790,2023-05-18 18:14:03.332703,0 days 00:00:08.398913,relu,1,0.00016778894964111798,6,512,2,1,COMPLETE
550,550,0.6701254367828369,2023-05-18 18:14:03.333762,2023-05-18 18:14:09.910488,0 days 00:00:06.576726,sigmoid,1,1.2208016391323536e-05,2,512,2,1,COMPLETE
551,551,0.6688619971275329,2023-05-18 18:14:09.911560,2023-05-18 18:14:17.148510,0 days 00:00:07.236950,sigmoid,1,0.00042475213747703526,2,512,2,0,COMPLETE
552,552,0.6720023155212402,2023-05-18 18:14:17.149767,2023-05-18 18:14:24.408812,0 days 00:00:07.259045,sigmoid,1,0.0026681449216583524,2,64,2,1,COMPLETE
553,553,0.7019506216049194,2023-05-18 18:14:24.409940,2023-05-18 18:14:32.436558,0 days 00:00:08.026618,sigmoid,1,8.661444800622566e-05,6,512,1,1,COMPLETE
554,554,0.6634986758232116,2023-05-18 18:14:32.437862,2023-05-18 18:14:39.286206,0 days 00:00:06.848344,sigmoid,1,0.0002130936435449037,2,512,2,1,COMPLETE
555,555,0.6864420056343079,2023-05-18 18:14:39.287450,2023-05-18 18:14:46.891903,0 days 00:00:07.604453,gelu,1,3.786651072750705e-05,2,512,2,1,COMPLETE
556,556,0.6628530859947205,2023-05-18 18:14:46.892972,2023-05-18 18:14:54.022485,0 days 00:00:07.129513,sigmoid,1,0.00015104219632602837,2,256,2,1,COMPLETE
557,557,0.6632546544075012,2023-05-18 18:14:54.023590,2023-05-18 18:15:01.011143,0 days 00:00:06.987553,sigmoid,1,0.00010528883141790543,2,512,2,1,COMPLETE
558,558,0.8151131868362427,2023-05-18 18:15:01.012397,2023-05-18 18:15:08.150433,0 days 00:00:07.138036,elu,1,0.0006093910291699743,3,512,2,1,COMPLETE
559,559,0.662417197227478,2023-05-18 18:15:08.151496,2023-05-18 18:15:15.127442,0 days 00:00:06.975946,sigmoid,1,0.0001384164733282792,2,512,2,0,COMPLETE
560,560,0.6635064005851745,2023-05-18 18:15:15.128726,2023-05-18 18:15:22.148337,0 days 00:00:07.019611,sigmoid,1,0.0001229520874078501,2,512,2,0,COMPLETE
561,561,0.6641871094703674,2023-05-18 18:15:22.149394,2023-05-18 18:15:29.186244,0 days 00:00:07.036850,sigmoid,1,6.496338529682006e-05,2,512,2,0,COMPLETE
