,number,value,datetime_start,datetime_complete,duration,params_activation,params_hidden_initializer,params_lr,params_n_layers,params_neurons,params_optimizer,params_output_initializer,state
985,985,0.6630090117454529,2023-05-18 19:06:56.700536,2023-05-18 19:07:04.468274,0 days 00:00:07.767738,sigmoid,1,0.000319099301272957,2,256,2,1,COMPLETE
986,986,0.6701513171195984,2023-05-18 19:07:04.469528,2023-05-18 19:07:11.720728,0 days 00:00:07.251200,sigmoid,1,0.00551191157081077,2,512,2,1,COMPLETE
987,987,0.6642071723937988,2023-05-18 19:07:11.721974,2023-05-18 19:07:19.028857,0 days 00:00:07.306883,sigmoid,1,0.00027471628768636506,2,128,0,1,COMPLETE
988,988,0.8262693762779236,2023-05-18 19:07:19.030106,2023-05-18 19:07:26.359860,0 days 00:00:07.329754,linear,1,1.0211167569269949e-05,4,256,2,1,COMPLETE
989,989,0.6808894991874694,2023-05-18 19:07:26.361277,2023-05-18 19:07:34.151701,0 days 00:00:07.790424,sigmoid,1,0.010567774360972736,2,512,2,0,COMPLETE
990,990,0.6636345624923706,2023-05-18 19:07:34.153077,2023-05-18 19:07:40.970136,0 days 00:00:06.817059,sigmoid,1,0.000200433693828652,2,256,2,1,COMPLETE
991,991,0.6959210157394409,2023-05-18 19:07:40.971346,2023-05-18 19:07:48.766362,0 days 00:00:07.795016,relu,1,0.00015336534187645825,2,512,2,1,COMPLETE
992,992,0.6626368641853333,2023-05-18 19:07:48.767798,2023-05-18 19:07:55.938824,0 days 00:00:07.171026,sigmoid,1,0.000238445712176258,2,256,2,1,COMPLETE
993,993,0.6726038098335266,2023-05-18 19:07:55.940119,2023-05-18 19:08:03.089424,0 days 00:00:07.149305,sigmoid,1,0.0009985240924759399,2,512,2,1,COMPLETE
994,994,0.6655366539955139,2023-05-18 19:08:03.090664,2023-05-18 19:08:10.174458,0 days 00:00:07.083794,sigmoid,1,7.735193643977075e-05,2,256,2,0,COMPLETE
995,995,0.6655787110328675,2023-05-18 19:08:10.175792,2023-05-18 19:08:17.333104,0 days 00:00:07.157312,sigmoid,1,0.00041496459716133853,2,512,2,1,COMPLETE
996,996,0.7467527747154236,2023-05-18 19:08:17.334488,2023-05-18 19:08:24.101489,0 days 00:00:06.767001,sigmoid,1,0.00010782165938996206,2,256,1,1,COMPLETE
997,997,0.6907260179519653,2023-05-18 19:08:24.102707,2023-05-18 19:08:32.171234,0 days 00:00:08.068527,elu,1,0.00017743131191192912,2,256,2,1,COMPLETE
998,998,0.6665820598602294,2023-05-18 19:08:32.172585,2023-05-18 19:08:39.294765,0 days 00:00:07.122180,sigmoid,1,0.0003000283818662307,2,512,2,1,COMPLETE
999,999,0.8672612905502319,2023-05-18 19:08:39.296071,2023-05-18 19:08:47.659743,0 days 00:00:08.363672,gelu,1,0.0006307656706641682,3,256,2,0,COMPLETE
