,number,value,datetime_start,datetime_complete,duration,params_activation,params_hidden_initializer,params_lr,params_n_layers,params_neurons,params_optimizer,params_output_initializer,state
0,0,0.6840303301811218,2023-05-18 17:10:25.466322,2023-05-18 17:10:34.447032,0 days 00:00:08.980710,elu,0,4.930344297264314e-05,6,512,0,1,COMPLETE
1,1,0.6731805205345154,2023-05-18 17:10:34.448026,2023-05-18 17:10:41.537579,0 days 00:00:07.089553,tanh,1,0.00027220751532289694,2,64,2,1,COMPLETE
2,2,0.7261224865913392,2023-05-18 17:10:41.538419,2023-05-18 17:10:50.187751,0 days 00:00:08.649332,tanh,1,0.019870103497656118,6,512,2,1,COMPLETE
3,3,0.7150400042533874,2023-05-18 17:10:50.188822,2023-05-18 17:10:57.366780,0 days 00:00:07.177958,elu,0,0.00010527422461132927,2,512,3,1,COMPLETE
4,4,0.685017192363739,2023-05-18 17:10:57.368103,2023-05-18 17:11:04.330528,0 days 00:00:06.962425,sigmoid,0,0.08624828994033674,2,256,1,0,COMPLETE
5,5,0.7037627220153808,2023-05-18 17:11:04.331400,2023-05-18 17:11:15.157197,0 days 00:00:10.825797,selu,0,1.155264153128873e-05,8,512,0,0,COMPLETE
6,6,0.8759756684303284,2023-05-18 17:11:15.158069,2023-05-18 17:11:24.232821,0 days 00:00:09.074752,tanh,0,0.0015284667079214869,9,64,2,1,COMPLETE
7,7,0.7933029174804688,2023-05-18 17:11:24.233755,2023-05-18 17:11:31.514821,0 days 00:00:07.281066,selu,1,0.006201746287931918,6,128,3,0,COMPLETE
8,8,857019663.0,2023-05-18 17:11:31.515980,2023-05-18 17:11:39.781504,0 days 00:00:08.265524,linear,0,0.055934765076972016,6,512,0,0,COMPLETE
9,9,0.6975216865539551,2023-05-18 17:11:39.782360,2023-05-18 17:11:48.107541,0 days 00:00:08.325181,tanh,0,0.019813231399488134,7,512,3,1,COMPLETE
10,10,0.7149428009986878,2023-05-18 17:11:48.108412,2023-05-18 17:11:58.165076,0 days 00:00:10.056664,gelu,1,0.0005711700031763442,4,64,2,1,COMPLETE
11,11,0.6996702313423157,2023-05-18 17:11:58.166441,2023-05-18 17:12:05.290460,0 days 00:00:07.124019,elu,1,8.81144873349299e-05,4,64,0,1,COMPLETE
12,12,0.7023486614227294,2023-05-18 17:12:05.291380,2023-05-18 17:12:13.820234,0 days 00:00:08.528854,relu,1,0.00010700093828390303,10,256,1,1,COMPLETE
13,13,0.7595946311950683,2023-05-18 17:12:13.821136,2023-05-18 17:12:20.759799,0 days 00:00:06.938663,elu,1,1.0941550222306725e-05,4,128,0,1,COMPLETE
14,14,0.6745512366294861,2023-05-18 17:12:20.760758,2023-05-18 17:12:28.179481,0 days 00:00:07.418723,relu,0,0.0005718342320006608,3,64,2,1,COMPLETE
15,15,0.6879301428794861,2023-05-18 17:12:28.181532,2023-05-18 17:12:35.086546,0 days 00:00:06.905014,relu,1,0.0005949003112839466,3,64,2,1,COMPLETE
16,16,0.7980612754821778,2023-05-18 17:12:35.087473,2023-05-18 17:12:41.952555,0 days 00:00:06.865082,relu,0,0.0016590093492060117,3,64,2,1,COMPLETE
17,17,0.6842056751251221,2023-05-18 17:12:41.953491,2023-05-18 17:12:48.393358,0 days 00:00:06.439867,linear,1,0.00031781944230156327,2,64,2,1,COMPLETE
18,18,0.6678014636039734,2023-05-18 17:12:48.394231,2023-05-18 17:12:55.082827,0 days 00:00:06.688596,sigmoid,0,0.0003053053571198439,3,64,2,0,COMPLETE
19,19,0.6729498505592346,2023-05-18 17:12:55.083757,2023-05-18 17:13:02.834362,0 days 00:00:07.750605,sigmoid,1,0.00023856330673671243,5,64,2,0,COMPLETE
20,20,0.6742415070533753,2023-05-18 17:13:02.835279,2023-05-18 17:13:09.923951,0 days 00:00:07.088672,sigmoid,0,0.0024968392880674603,5,256,1,0,COMPLETE
21,21,0.6733391165733338,2023-05-18 17:13:09.924881,2023-05-18 17:13:17.452834,0 days 00:00:07.527953,sigmoid,1,0.0002486596447623566,5,64,2,0,COMPLETE
22,22,0.6686765670776367,2023-05-18 17:13:17.453889,2023-05-18 17:13:24.380215,0 days 00:00:06.926326,sigmoid,1,0.00023199672834445825,3,64,2,0,COMPLETE
23,23,0.7327890157699585,2023-05-18 17:13:24.381157,2023-05-18 17:13:32.120698,0 days 00:00:07.739541,sigmoid,1,4.0333119593623804e-05,5,64,2,0,COMPLETE
24,24,0.6677699327468872,2023-05-18 17:13:32.121641,2023-05-18 17:13:39.848246,0 days 00:00:07.726605,sigmoid,1,0.00021891413806341553,4,128,2,0,COMPLETE
25,25,0.6627701640129089,2023-05-18 17:13:39.849330,2023-05-18 17:13:46.548334,0 days 00:00:06.699004,sigmoid,1,0.0008049694349564065,3,128,2,0,COMPLETE
26,26,0.6670569896697998,2023-05-18 17:13:46.549277,2023-05-18 17:13:53.627634,0 days 00:00:07.078357,sigmoid,1,0.0012601895282960596,4,128,2,0,COMPLETE
27,27,1.6555566549301148,2023-05-18 17:13:53.628525,2023-05-18 17:14:02.456256,0 days 00:00:08.827731,gelu,1,0.0031330629755729434,4,128,2,0,COMPLETE
28,28,0.6787374973297119,2023-05-18 17:14:02.457146,2023-05-18 17:14:09.579737,0 days 00:00:07.122591,sigmoid,1,0.0008045092984692299,4,128,1,0,COMPLETE
29,29,0.6743902087211608,2023-05-18 17:14:09.580634,2023-05-18 17:14:16.859845,0 days 00:00:07.279211,sigmoid,1,0.0012131304164617182,5,128,3,0,COMPLETE
30,30,0.6681081891059876,2023-05-18 17:14:16.860724,2023-05-18 17:14:24.883255,0 days 00:00:08.022531,sigmoid,1,0.004791838248045094,7,128,2,0,COMPLETE
31,31,0.6636370182037353,2023-05-18 17:14:24.884255,2023-05-18 17:14:32.438633,0 days 00:00:07.554378,sigmoid,1,0.0008175154749929015,3,128,2,0,COMPLETE
32,32,0.6658953785896301,2023-05-18 17:14:32.439566,2023-05-18 17:14:39.103369,0 days 00:00:06.663803,sigmoid,1,0.0009875422963186685,3,128,2,0,COMPLETE
33,33,0.6664169192314148,2023-05-18 17:14:39.104468,2023-05-18 17:14:45.935633,0 days 00:00:06.831165,sigmoid,1,0.0009860931256598356,2,128,2,0,COMPLETE
34,34,0.6639355301856995,2023-05-18 17:14:45.936559,2023-05-18 17:14:52.432172,0 days 00:00:06.495613,sigmoid,1,0.0007857626663076268,2,128,2,0,COMPLETE
35,35,0.8718156337738037,2023-05-18 17:14:52.433089,2023-05-18 17:15:00.275708,0 days 00:00:07.842619,gelu,1,0.002362957133840743,2,128,2,0,COMPLETE
36,36,0.7031497001647949,2023-05-18 17:15:00.276588,2023-05-18 17:15:07.314773,0 days 00:00:07.038185,selu,1,0.0007224836115669482,2,128,2,0,COMPLETE
37,37,0.7057690978050232,2023-05-18 17:15:07.315734,2023-05-18 17:15:13.944066,0 days 00:00:06.628332,sigmoid,1,0.00039603242569941733,3,128,3,0,COMPLETE
38,38,0.68571617603302,2023-05-18 17:15:13.944981,2023-05-18 17:15:20.431794,0 days 00:00:06.486813,linear,1,0.001767748490452927,2,128,2,0,COMPLETE
39,39,0.730379319190979,2023-05-18 17:15:20.432710,2023-05-18 17:15:27.041599,0 days 00:00:06.608889,tanh,1,0.0008679832589708814,3,128,1,0,COMPLETE
40,40,0.6709163784980774,2023-05-18 17:15:27.042606,2023-05-18 17:15:33.404816,0 days 00:00:06.362210,sigmoid,1,0.0012704619015866635,2,256,0,0,COMPLETE
41,41,0.6652674913406372,2023-05-18 17:15:33.405702,2023-05-18 17:15:40.442760,0 days 00:00:07.037058,sigmoid,1,0.0009526394853572527,2,128,2,0,COMPLETE
42,42,0.692205011844635,2023-05-18 17:15:40.443660,2023-05-18 17:15:47.494969,0 days 00:00:07.051309,sigmoid,1,0.004324558491650403,3,128,2,0,COMPLETE
43,43,0.7226241111755372,2023-05-18 17:15:47.495898,2023-05-18 17:15:54.062546,0 days 00:00:06.566648,selu,1,0.0016712214992862695,2,128,2,0,COMPLETE
44,44,0.6675670266151428,2023-05-18 17:15:54.063453,2023-05-18 17:16:00.556971,0 days 00:00:06.493518,sigmoid,1,0.00046879070761453637,2,512,2,0,COMPLETE
45,45,0.6739777803421021,2023-05-18 17:16:00.557931,2023-05-18 17:16:07.445807,0 days 00:00:06.887876,sigmoid,1,0.0009056336471447065,3,128,3,0,COMPLETE
46,46,0.995572316646576,2023-05-18 17:16:07.446699,2023-05-18 17:16:16.418329,0 days 00:00:08.971630,elu,1,0.0005894716072437382,8,128,2,0,COMPLETE
47,47,0.6639574885368347,2023-05-18 17:16:16.419397,2023-05-18 17:16:23.083743,0 days 00:00:06.664346,sigmoid,1,0.0004589848438218675,2,128,0,0,COMPLETE
48,48,0.6900097966194153,2023-05-18 17:16:23.084654,2023-05-18 17:16:29.646101,0 days 00:00:06.561447,tanh,1,0.0001414444688379399,2,512,0,0,COMPLETE
49,49,0.7084722876548767,2023-05-18 17:16:29.647118,2023-05-18 17:16:36.437762,0 days 00:00:06.790644,linear,1,0.0005213354082820312,2,128,0,0,COMPLETE
50,50,0.7889182925224304,2023-05-18 17:16:36.438662,2023-05-18 17:16:45.438631,0 days 00:00:08.999969,elu,0,0.00037697525034541247,10,256,0,0,COMPLETE
51,51,0.6721428155899047,2023-05-18 17:16:45.439513,2023-05-18 17:16:52.152345,0 days 00:00:06.712832,sigmoid,1,0.0008178640082517931,3,128,0,0,COMPLETE
52,52,0.665019941329956,2023-05-18 17:16:52.153237,2023-05-18 17:16:59.201301,0 days 00:00:07.048064,sigmoid,1,0.0011458315284183528,3,128,2,0,COMPLETE
53,53,0.6657505750656127,2023-05-18 17:16:59.202206,2023-05-18 17:17:06.065319,0 days 00:00:06.863113,sigmoid,1,0.00046500818321304574,3,128,0,0,COMPLETE
54,54,0.6723552942276001,2023-05-18 17:17:06.066239,2023-05-18 17:17:13.390797,0 days 00:00:07.324558,sigmoid,1,0.0022755750819486564,2,128,2,0,COMPLETE
55,55,0.7214491128921509,2023-05-18 17:17:13.393007,2023-05-18 17:17:21.708227,0 days 00:00:08.315220,gelu,1,0.0015076750990879254,4,128,1,0,COMPLETE
56,56,0.6973574757575989,2023-05-18 17:17:21.709395,2023-05-18 17:17:28.213722,0 days 00:00:06.504327,relu,0,0.0007158765614663589,2,128,2,0,COMPLETE
57,57,0.6656814455986023,2023-05-18 17:17:28.214643,2023-05-18 17:17:35.095804,0 days 00:00:06.881161,sigmoid,1,0.00034516813963171296,3,512,2,1,COMPLETE
58,58,0.8061935424804687,2023-05-18 17:17:35.096715,2023-05-18 17:17:41.707952,0 days 00:00:06.611237,selu,1,0.0012055006896572976,3,128,0,0,COMPLETE
59,59,0.6734367847442627,2023-05-18 17:17:41.708811,2023-05-18 17:17:49.489753,0 days 00:00:07.780942,sigmoid,1,0.0019729584673958737,4,256,2,0,COMPLETE
60,60,0.6749238610267639,2023-05-18 17:17:49.490724,2023-05-18 17:17:56.294634,0 days 00:00:06.803910,sigmoid,1,0.0006323656318521035,2,128,3,1,COMPLETE
61,61,0.6667092204093933,2023-05-18 17:17:56.295565,2023-05-18 17:18:03.097383,0 days 00:00:06.801818,sigmoid,1,0.0003606836426247745,3,512,2,1,COMPLETE
62,62,0.6698930859565735,2023-05-18 17:18:03.098344,2023-05-18 17:18:09.852614,0 days 00:00:06.754270,sigmoid,1,0.0004696566463883445,3,512,2,1,COMPLETE
63,63,0.6641735911369324,2023-05-18 17:18:09.853666,2023-05-18 17:18:16.688109,0 days 00:00:06.834443,sigmoid,1,0.00030082934443827517,2,512,2,1,COMPLETE
64,64,0.6639622807502746,2023-05-18 17:18:16.689016,2023-05-18 17:18:24.290615,0 days 00:00:07.601599,sigmoid,1,0.00019962160472958542,2,512,2,1,COMPLETE
65,65,0.6799689173698426,2023-05-18 17:18:24.291527,2023-05-18 17:18:31.286677,0 days 00:00:06.995150,tanh,0,0.00017975859974505982,2,512,2,1,COMPLETE
66,66,0.663821005821228,2023-05-18 17:18:31.287583,2023-05-18 17:18:38.337078,0 days 00:00:07.049495,sigmoid,1,0.00030373443548671847,2,512,2,1,COMPLETE
67,67,0.6661442637443542,2023-05-18 17:18:38.339002,2023-05-18 17:18:44.896259,0 days 00:00:06.557257,sigmoid,1,0.00029444320801540414,2,512,2,1,COMPLETE
68,68,1.2445006132125855,2023-05-18 17:18:44.897160,2023-05-18 17:18:53.877969,0 days 00:00:08.980809,relu,1,0.00018393151391369767,7,512,2,1,COMPLETE
69,69,0.9509562373161315,2023-05-18 17:18:53.879250,2023-05-18 17:19:00.183697,0 days 00:00:06.304447,linear,1,0.00013063477925709296,2,512,1,1,COMPLETE
70,70,0.664058244228363,2023-05-18 17:19:00.184672,2023-05-18 17:19:06.738995,0 days 00:00:06.554323,sigmoid,1,0.00027053421119240635,2,512,2,1,COMPLETE
71,71,0.6646387100219726,2023-05-18 17:19:06.740075,2023-05-18 17:19:13.526232,0 days 00:00:06.786157,sigmoid,1,0.00026380880431821395,2,512,2,1,COMPLETE
72,72,0.6640083909034729,2023-05-18 17:19:13.527136,2023-05-18 17:19:19.904196,0 days 00:00:06.377060,sigmoid,1,0.00020650358699859142,2,512,2,1,COMPLETE
73,73,0.6633131861686706,2023-05-18 17:19:19.905077,2023-05-18 17:19:26.819921,0 days 00:00:06.914844,sigmoid,1,0.0001962878245375596,2,512,2,1,COMPLETE
74,74,0.6630833745002747,2023-05-18 17:19:26.821000,2023-05-18 17:19:33.769829,0 days 00:00:06.948829,sigmoid,1,7.86968378047695e-05,2,512,2,1,COMPLETE
75,75,0.697373342514038,2023-05-18 17:19:33.770749,2023-05-18 17:19:41.730495,0 days 00:00:07.959746,gelu,1,7.854556830371751e-05,3,512,2,1,COMPLETE
76,76,0.6635882973670959,2023-05-18 17:19:41.731423,2023-05-18 17:19:48.668735,0 days 00:00:06.937312,sigmoid,1,7.573063894911906e-05,2,512,2,1,COMPLETE
77,77,0.7102914214134216,2023-05-18 17:19:48.669772,2023-05-18 17:19:58.200229,0 days 00:00:09.530457,elu,0,7.117009926855183e-05,9,512,0,1,COMPLETE
78,78,0.7286999702453614,2023-05-18 17:19:58.201376,2023-05-18 17:20:05.169725,0 days 00:00:06.968349,sigmoid,1,3.4567992121271716e-05,3,512,3,1,COMPLETE
79,79,0.6621357440948487,2023-05-18 17:20:05.170658,2023-05-18 17:20:12.081923,0 days 00:00:06.911265,sigmoid,1,0.0001303465936621114,2,512,2,1,COMPLETE
80,80,0.7072805523872375,2023-05-18 17:20:12.083019,2023-05-18 17:20:18.563292,0 days 00:00:06.480273,selu,1,0.00011294638935898102,2,512,2,1,COMPLETE
81,81,0.6651596426963806,2023-05-18 17:20:18.564222,2023-05-18 17:20:25.707085,0 days 00:00:07.142863,sigmoid,1,5.750092908212586e-05,2,512,2,1,COMPLETE
82,82,0.6735389471054077,2023-05-18 17:20:25.708261,2023-05-18 17:20:34.448273,0 days 00:00:08.740012,sigmoid,1,0.00015350378628234648,6,512,2,1,COMPLETE
83,83,0.6632633924484252,2023-05-18 17:20:34.449188,2023-05-18 17:20:41.440032,0 days 00:00:06.990844,sigmoid,1,0.00010593651943059273,2,512,2,1,COMPLETE
84,84,0.6630063414573669,2023-05-18 17:20:41.441014,2023-05-18 17:20:48.316353,0 days 00:00:06.875339,sigmoid,1,0.00011139967964149258,2,512,2,1,COMPLETE
85,85,0.6656683444976806,2023-05-18 17:20:48.317386,2023-05-18 17:20:55.115592,0 days 00:00:06.798206,sigmoid,1,9.784311192261399e-05,3,512,2,1,COMPLETE
86,86,0.663344144821167,2023-05-18 17:20:55.116511,2023-05-18 17:21:02.527093,0 days 00:00:07.410582,sigmoid,1,0.00011724283504175845,2,512,2,1,COMPLETE
87,87,0.6661184191703796,2023-05-18 17:21:02.528058,2023-05-18 17:21:09.929880,0 days 00:00:07.401822,sigmoid,1,9.297257295532856e-05,3,512,2,1,COMPLETE
88,88,0.6756510019302369,2023-05-18 17:21:09.930800,2023-05-18 17:21:16.882676,0 days 00:00:06.951876,tanh,1,6.072789273268361e-05,2,512,2,1,COMPLETE
89,89,0.6637755155563354,2023-05-18 17:21:16.883593,2023-05-18 17:21:23.851345,0 days 00:00:06.967752,sigmoid,1,0.00010595240778422478,2,512,2,1,COMPLETE
90,90,0.6912387251853943,2023-05-18 17:21:23.852399,2023-05-18 17:21:30.572127,0 days 00:00:06.719728,linear,1,4.038379747960991e-05,3,512,2,1,COMPLETE
91,91,0.6637110233306884,2023-05-18 17:21:30.573197,2023-05-18 17:21:37.287945,0 days 00:00:06.714748,sigmoid,1,0.00011309442827541353,2,512,2,1,COMPLETE
92,92,0.663257110118866,2023-05-18 17:21:37.288861,2023-05-18 17:21:44.925635,0 days 00:00:07.636774,sigmoid,1,0.00013647639263092645,2,512,2,1,COMPLETE
93,93,0.6620703101158142,2023-05-18 17:21:44.926594,2023-05-18 17:21:51.880266,0 days 00:00:06.953672,sigmoid,1,0.0001572719374521295,2,512,2,1,COMPLETE
94,94,0.6643681645393371,2023-05-18 17:21:51.881178,2023-05-18 17:21:58.824158,0 days 00:00:06.942980,sigmoid,1,0.00015955228803325703,2,512,2,1,COMPLETE
95,95,0.6624794244766236,2023-05-18 17:21:58.825095,2023-05-18 17:22:05.952027,0 days 00:00:07.126932,sigmoid,1,0.00012972662378216553,2,512,2,1,COMPLETE
96,96,0.7561397552490234,2023-05-18 17:22:05.952923,2023-05-18 17:22:12.316095,0 days 00:00:06.363172,relu,1,0.00012633688065003868,2,512,1,1,COMPLETE
97,97,0.6629115819931031,2023-05-18 17:22:12.316988,2023-05-18 17:22:19.278922,0 days 00:00:06.961934,sigmoid,0,0.00014927069916854222,2,512,2,1,COMPLETE
98,98,0.6636264085769653,2023-05-18 17:22:19.279849,2023-05-18 17:22:26.014404,0 days 00:00:06.734555,sigmoid,0,0.00015662777001594643,2,512,2,1,COMPLETE
99,99,0.6712796807289123,2023-05-18 17:22:26.015325,2023-05-18 17:22:32.474431,0 days 00:00:06.459106,elu,0,0.0002376565296599956,2,256,2,1,COMPLETE
100,100,0.6648845195770263,2023-05-18 17:22:32.475344,2023-05-18 17:22:39.279341,0 days 00:00:06.803997,sigmoid,0,8.75737489926009e-05,2,512,2,1,COMPLETE
101,101,0.6643672227859497,2023-05-18 17:22:39.280414,2023-05-18 17:22:45.812964,0 days 00:00:06.532550,sigmoid,0,0.00013121594254608942,2,512,2,1,COMPLETE
102,102,0.6646277904510498,2023-05-18 17:22:45.813948,2023-05-18 17:22:52.922316,0 days 00:00:07.108368,sigmoid,0,0.0001771280485912882,2,512,2,1,COMPLETE
103,103,0.6634141564369201,2023-05-18 17:22:52.924375,2023-05-18 17:22:59.555058,0 days 00:00:06.630683,sigmoid,1,0.00021714713848158774,2,512,2,1,COMPLETE
104,104,0.6901071310043335,2023-05-18 17:22:59.556120,2023-05-18 17:23:06.828796,0 days 00:00:07.272676,gelu,1,0.0001313698899628701,2,512,2,1,COMPLETE
105,105,0.6665763258934021,2023-05-18 17:23:06.829748,2023-05-18 17:23:14.209254,0 days 00:00:07.379506,sigmoid,1,8.70737535568347e-05,3,512,2,1,COMPLETE
106,106,0.7554906010627747,2023-05-18 17:23:14.210192,2023-05-18 17:23:21.093513,0 days 00:00:06.883321,sigmoid,0,0.00010676483557549451,2,64,3,1,COMPLETE
107,107,0.6669761180877686,2023-05-18 17:23:21.094460,2023-05-18 17:23:28.756355,0 days 00:00:07.661895,sigmoid,1,6.465801987962354e-05,3,512,2,1,COMPLETE
108,108,0.6631876468658447,2023-05-18 17:23:28.757295,2023-05-18 17:23:35.443248,0 days 00:00:06.685953,sigmoid,1,0.0001595869172280093,2,512,2,1,COMPLETE
109,109,0.7154447555541992,2023-05-18 17:23:35.444325,2023-05-18 17:23:42.085675,0 days 00:00:06.641350,selu,1,0.00016001010885385907,2,512,2,1,COMPLETE
110,110,0.6627265572547912,2023-05-18 17:23:42.086591,2023-05-18 17:23:49.043572,0 days 00:00:06.956981,sigmoid,1,0.00020288557115196793,3,512,2,1,COMPLETE
111,111,0.6625013232231141,2023-05-18 17:23:49.044615,2023-05-18 17:23:55.838480,0 days 00:00:06.793865,sigmoid,1,0.00019494348716483367,3,512,2,1,COMPLETE
112,112,0.6659849047660827,2023-05-18 17:23:55.839552,2023-05-18 17:24:04.016055,0 days 00:00:08.176503,sigmoid,1,0.00014169187554414318,4,512,2,1,COMPLETE
113,113,0.6631290435791015,2023-05-18 17:24:04.017074,2023-05-18 17:24:10.816225,0 days 00:00:06.799151,sigmoid,1,0.0002152019730774736,3,512,2,1,COMPLETE
114,114,0.6686580181121826,2023-05-18 17:24:10.817298,2023-05-18 17:24:18.276112,0 days 00:00:07.458814,sigmoid,1,0.00017247408788187253,4,512,2,1,COMPLETE
115,115,0.6640515685081482,2023-05-18 17:24:18.277048,2023-05-18 17:24:25.426844,0 days 00:00:07.149796,sigmoid,1,0.0002310050405654436,3,256,2,1,COMPLETE
116,116,0.6629725813865661,2023-05-18 17:24:25.427763,2023-05-18 17:24:33.491552,0 days 00:00:08.063789,sigmoid,1,0.00025600619792189575,3,512,2,1,COMPLETE
117,117,0.7291534304618835,2023-05-18 17:24:33.492528,2023-05-18 17:24:40.387458,0 days 00:00:06.894930,tanh,1,0.0003642987830303801,3,512,1,1,COMPLETE
118,118,0.6728058218955993,2023-05-18 17:24:40.388406,2023-05-18 17:24:47.502502,0 days 00:00:07.114096,sigmoid,1,0.00026015388883903823,5,64,2,1,COMPLETE
119,119,0.6641486883163452,2023-05-18 17:24:47.503547,2023-05-18 17:24:54.232510,0 days 00:00:06.728963,sigmoid,1,0.00021677404801380326,3,512,2,1,COMPLETE
120,120,0.6836719155311585,2023-05-18 17:24:54.233512,2023-05-18 17:25:01.305417,0 days 00:00:07.071905,linear,0,0.00019221889404046302,4,512,2,1,COMPLETE
121,121,0.6637197971343994,2023-05-18 17:25:01.306321,2023-05-18 17:25:08.692229,0 days 00:00:07.385908,sigmoid,1,0.00015484795654612682,3,512,2,1,COMPLETE
122,122,0.6632116317749024,2023-05-18 17:25:08.693276,2023-05-18 17:25:15.518872,0 days 00:00:06.825596,sigmoid,1,0.00027759861389824327,3,512,2,1,COMPLETE
123,123,0.6641702294349671,2023-05-18 17:25:15.520022,2023-05-18 17:25:22.276371,0 days 00:00:06.756349,sigmoid,1,0.00029636141946172987,3,512,2,1,COMPLETE
124,124,0.6653727173805237,2023-05-18 17:25:22.277272,2023-05-18 17:25:29.674361,0 days 00:00:07.397089,sigmoid,1,0.0003919333575093269,3,512,2,1,COMPLETE
125,125,0.7449408054351807,2023-05-18 17:25:29.675277,2023-05-18 17:25:37.065025,0 days 00:00:07.389748,relu,1,0.00024542549124471387,3,512,2,1,COMPLETE
126,126,0.6652559638023376,2023-05-18 17:25:37.066031,2023-05-18 17:25:44.438858,0 days 00:00:07.372827,sigmoid,1,0.0001902162038584161,4,512,2,1,COMPLETE
127,127,0.6741628170013427,2023-05-18 17:25:44.439803,2023-05-18 17:25:51.327577,0 days 00:00:06.887774,sigmoid,1,0.0003282592357017708,4,512,3,1,COMPLETE
128,128,0.6656730771064758,2023-05-18 17:25:51.328523,2023-05-18 17:25:58.542270,0 days 00:00:07.213747,sigmoid,1,7.875806975459989e-05,3,512,2,1,COMPLETE
129,129,0.8056509256362915,2023-05-18 17:25:58.543190,2023-05-18 17:26:06.551157,0 days 00:00:08.007967,gelu,1,0.00026190293331291307,3,512,2,1,COMPLETE
130,130,0.7085184216499328,2023-05-18 17:26:06.552181,2023-05-18 17:26:14.365100,0 days 00:00:07.812919,elu,1,9.324965887370676e-05,3,512,2,1,COMPLETE
131,131,0.6652955770492553,2023-05-18 17:26:14.366173,2023-05-18 17:26:21.452398,0 days 00:00:07.086225,sigmoid,1,0.0001381535498718867,3,512,2,1,COMPLETE
132,132,0.6637224793434143,2023-05-18 17:26:21.453330,2023-05-18 17:26:28.019796,0 days 00:00:06.566466,sigmoid,1,0.00013100099684649198,2,512,2,1,COMPLETE
133,133,0.6635250449180603,2023-05-18 17:26:28.020874,2023-05-18 17:26:34.579819,0 days 00:00:06.558945,sigmoid,1,0.00016953957170250626,2,512,2,1,COMPLETE
134,134,0.6635961651802063,2023-05-18 17:26:34.580749,2023-05-18 17:26:41.422734,0 days 00:00:06.841985,sigmoid,1,0.00020239924301198613,3,512,2,1,COMPLETE
135,135,0.6638834238052368,2023-05-18 17:26:41.423739,2023-05-18 17:26:49.433278,0 days 00:00:08.009539,sigmoid,1,0.00011664157045199688,2,512,2,1,COMPLETE
136,136,0.6674345374107361,2023-05-18 17:26:49.434207,2023-05-18 17:26:56.509876,0 days 00:00:07.075669,sigmoid,1,0.0004240161197128619,2,512,2,1,COMPLETE
137,137,0.6633090376853943,2023-05-18 17:26:56.510826,2023-05-18 17:27:03.642832,0 days 00:00:07.132006,sigmoid,1,0.0001525446079170316,2,256,2,1,COMPLETE
138,138,0.6801165699958801,2023-05-18 17:27:03.643782,2023-05-18 17:27:12.756679,0 days 00:00:09.112897,sigmoid,1,0.0005375183893817297,8,512,2,1,COMPLETE
139,139,0.7269017457962036,2023-05-18 17:27:12.757614,2023-05-18 17:27:19.975447,0 days 00:00:07.217833,selu,0,0.0003250256231978781,3,512,1,1,COMPLETE
140,140,0.6658340811729431,2023-05-18 17:27:19.977497,2023-05-18 17:27:26.959125,0 days 00:00:06.981628,sigmoid,1,0.00022651296418662288,2,64,2,1,COMPLETE
