,number,value,datetime_start,datetime_complete,duration,params_activation,params_hidden_initializer,params_lr,params_n_layers,params_neurons,params_optimizer,params_output_initializer,state
703,703,0.6749485731124878,2023-05-18 18:32:24.857877,2023-05-18 18:32:32.534327,0 days 00:00:07.676450,sigmoid,1,0.021144492886077115,5,256,2,0,COMPLETE
704,704,0.6720549106597901,2023-05-18 18:32:32.536355,2023-05-18 18:32:40.017501,0 days 00:00:07.481146,sigmoid,1,3.419334439814992e-05,3,256,2,1,COMPLETE
705,705,0.6752364039421082,2023-05-18 18:32:40.018635,2023-05-18 18:32:46.955256,0 days 00:00:06.936621,sigmoid,1,0.0024912341188036624,2,256,1,1,COMPLETE
706,706,0.6977835893630981,2023-05-18 18:32:46.956415,2023-05-18 18:32:53.607353,0 days 00:00:06.650938,elu,1,4.662940352079907e-05,2,256,2,1,COMPLETE
707,707,0.6835322141647339,2023-05-18 18:32:53.608475,2023-05-18 18:33:01.717249,0 days 00:00:08.108774,gelu,1,0.00036010037625498276,2,64,2,1,COMPLETE
708,708,0.6888000249862671,2023-05-18 18:33:01.718558,2023-05-18 18:33:08.725442,0 days 00:00:07.006884,sigmoid,1,0.08577759855267468,2,256,2,1,COMPLETE
709,709,0.6616405248641968,2023-05-18 18:33:08.726645,2023-05-18 18:33:15.544029,0 days 00:00:06.817384,sigmoid,1,0.0002776328752493523,2,256,2,0,COMPLETE
710,710,0.6648945689201355,2023-05-18 18:33:15.545325,2023-05-18 18:33:22.632441,0 days 00:00:07.087116,sigmoid,1,0.00027995087656830666,3,128,2,0,COMPLETE
711,711,0.663881516456604,2023-05-18 18:33:22.633561,2023-05-18 18:33:29.281526,0 days 00:00:06.647965,sigmoid,1,0.0004015233813087219,2,256,2,0,COMPLETE
712,712,0.6632503271102905,2023-05-18 18:33:29.282655,2023-05-18 18:33:37.081190,0 days 00:00:07.798535,sigmoid,1,0.00032188909494432465,2,256,2,0,COMPLETE
713,713,0.6669659972190857,2023-05-18 18:33:37.082343,2023-05-18 18:33:44.166190,0 days 00:00:07.083847,sigmoid,1,0.000769078072194842,2,256,2,0,COMPLETE
714,714,0.6624723315238953,2023-05-18 18:33:44.167466,2023-05-18 18:33:51.045823,0 days 00:00:06.878357,sigmoid,1,0.0001956756403699904,2,256,2,0,COMPLETE
715,715,0.665120530128479,2023-05-18 18:33:51.046967,2023-05-18 18:33:57.826917,0 days 00:00:06.779950,sigmoid,1,0.0004987730558635947,2,256,2,0,COMPLETE
716,716,0.8407904624938964,2023-05-18 18:33:57.828073,2023-05-18 18:34:04.779460,0 days 00:00:06.951387,selu,1,0.00025993428636137203,2,256,3,0,COMPLETE
717,717,0.796574056148529,2023-05-18 18:34:04.781833,2023-05-18 18:34:11.409005,0 days 00:00:06.627172,sigmoid,1,0.0303486475854579,2,64,2,0,COMPLETE
718,718,0.6630160093307496,2023-05-18 18:34:11.410095,2023-05-18 18:34:18.991478,0 days 00:00:07.581383,sigmoid,1,0.00019299008576050144,2,256,2,0,COMPLETE
719,719,0.6706266760826111,2023-05-18 18:34:18.992663,2023-05-18 18:34:26.794904,0 days 00:00:07.802241,sigmoid,0,0.0018783741514822282,4,256,2,0,COMPLETE
720,720,0.6690625429153443,2023-05-18 18:34:26.796103,2023-05-18 18:34:33.683592,0 days 00:00:06.887489,sigmoid,1,4.00432138434897e-05,2,256,0,0,COMPLETE
721,721,0.6635088920593262,2023-05-18 18:34:33.684786,2023-05-18 18:34:41.509627,0 days 00:00:07.824841,sigmoid,1,0.00022449006539980662,2,128,2,0,COMPLETE
722,722,0.6626922965049744,2023-05-18 18:34:41.510772,2023-05-18 18:34:48.646110,0 days 00:00:07.135338,sigmoid,1,0.0003187556970643149,3,256,2,0,COMPLETE
723,723,0.7032068848609925,2023-05-18 18:34:48.647339,2023-05-18 18:34:55.641185,0 days 00:00:06.993846,tanh,1,1.2985767763510654e-05,2,256,2,0,COMPLETE
724,724,0.6725773453712464,2023-05-18 18:34:55.642309,2023-05-18 18:35:03.652061,0 days 00:00:08.009752,sigmoid,1,0.0018426275756258177,2,256,2,0,COMPLETE
725,725,0.6949818134307861,2023-05-18 18:35:03.653251,2023-05-18 18:35:10.591474,0 days 00:00:06.938223,sigmoid,1,0.013837881192186118,2,256,2,0,COMPLETE
726,726,0.663244903087616,2023-05-18 18:35:10.592772,2023-05-18 18:35:17.436493,0 days 00:00:06.843721,sigmoid,1,0.0001774248422116592,2,256,2,1,COMPLETE
727,727,0.6776897788047791,2023-05-18 18:35:17.438708,2023-05-18 18:35:24.124669,0 days 00:00:06.685961,sigmoid,1,1.5144636915220313e-05,2,256,2,0,COMPLETE
728,728,0.6875108480453491,2023-05-18 18:35:24.125931,2023-05-18 18:35:30.783108,0 days 00:00:06.657177,linear,1,0.00025929848222417984,2,256,2,1,COMPLETE
729,729,0.8183574795722961,2023-05-18 18:35:30.784256,2023-05-18 18:35:37.322493,0 days 00:00:06.538237,relu,1,0.00039636813800771834,2,64,1,1,COMPLETE
730,730,0.6644125699996948,2023-05-18 18:35:37.323612,2023-05-18 18:35:45.188976,0 days 00:00:07.865364,sigmoid,1,0.00021249292585049002,3,256,2,1,COMPLETE
731,731,0.6747092485427857,2023-05-18 18:35:45.190163,2023-05-18 18:35:52.472015,0 days 00:00:07.281852,sigmoid,1,0.0026582466712089165,2,256,2,1,COMPLETE
732,732,0.6910279631614685,2023-05-18 18:35:52.473195,2023-05-18 18:35:59.633851,0 days 00:00:07.160656,sigmoid,1,0.008034061930590428,2,256,2,0,COMPLETE
733,733,0.7438443303108215,2023-05-18 18:35:59.634995,2023-05-18 18:36:06.341212,0 days 00:00:06.706217,sigmoid,1,0.011523361161329564,2,128,2,1,COMPLETE
734,734,0.8566134452819825,2023-05-18 18:36:06.342353,2023-05-18 18:36:13.023933,0 days 00:00:06.681580,elu,1,0.005042817125723884,2,256,2,1,COMPLETE
735,735,0.662472665309906,2023-05-18 18:36:13.025047,2023-05-18 18:36:20.355886,0 days 00:00:07.330839,sigmoid,1,0.00017454682375975353,2,256,2,1,COMPLETE
736,736,0.6624120593070983,2023-05-18 18:36:20.357048,2023-05-18 18:36:27.575511,0 days 00:00:07.218463,sigmoid,1,0.0002675983100871611,2,256,2,1,COMPLETE
737,737,0.7321701765060424,2023-05-18 18:36:27.576737,2023-05-18 18:36:35.267063,0 days 00:00:07.690326,gelu,1,0.0006004481542029636,2,256,2,1,COMPLETE
738,738,0.663615369796753,2023-05-18 18:36:35.268232,2023-05-18 18:36:41.960064,0 days 00:00:06.691832,sigmoid,0,0.0003302109807602944,2,256,2,0,COMPLETE
739,739,0.6659839510917663,2023-05-18 18:36:41.961229,2023-05-18 18:36:48.698260,0 days 00:00:06.737031,sigmoid,1,0.0008692339980924447,2,256,2,1,COMPLETE
740,740,0.7741259932518005,2023-05-18 18:36:48.699537,2023-05-18 18:36:55.341662,0 days 00:00:06.642125,sigmoid,1,0.03725797659945312,2,64,2,1,COMPLETE
741,741,0.6928081154823303,2023-05-18 18:36:55.342765,2023-05-18 18:37:02.688012,0 days 00:00:07.345247,sigmoid,1,0.00021738797382340395,2,256,3,1,COMPLETE
742,742,0.6877836942672729,2023-05-18 18:37:02.689361,2023-05-18 18:37:09.760456,0 days 00:00:07.071095,sigmoid,1,0.009057763193839384,2,256,2,1,COMPLETE
743,743,0.6625708222389222,2023-05-18 18:37:09.761764,2023-05-18 18:37:16.642625,0 days 00:00:06.880861,sigmoid,1,0.000477600109333937,2,128,2,1,COMPLETE
744,744,0.7015875577926636,2023-05-18 18:37:16.643862,2023-05-18 18:37:23.749831,0 days 00:00:07.105969,selu,1,0.00016938732628106053,2,256,0,0,COMPLETE
745,745,0.6643404841423035,2023-05-18 18:37:23.750976,2023-05-18 18:37:31.399914,0 days 00:00:07.648938,sigmoid,1,0.0003624152987209236,2,512,2,1,COMPLETE
746,746,0.6629425764083863,2023-05-18 18:37:31.401185,2023-05-18 18:37:38.101908,0 days 00:00:06.700723,sigmoid,1,0.00021696296731467743,2,256,2,1,COMPLETE
747,747,0.6623677849769593,2023-05-18 18:37:38.103056,2023-05-18 18:37:45.646668,0 days 00:00:07.543612,sigmoid,1,0.00027784103330018994,2,512,2,1,COMPLETE
748,748,0.6741850018501282,2023-05-18 18:37:45.647894,2023-05-18 18:37:54.026441,0 days 00:00:08.378547,sigmoid,1,0.00015810818560959062,7,256,2,1,COMPLETE
749,749,0.6677703738212586,2023-05-18 18:37:54.027599,2023-05-18 18:38:01.222698,0 days 00:00:07.195099,sigmoid,1,2.7591702738753403e-05,2,512,2,0,COMPLETE
750,750,0.6636842608451843,2023-05-18 18:38:01.223929,2023-05-18 18:38:08.342971,0 days 00:00:07.119042,sigmoid,1,0.00018814946514918867,3,512,2,1,COMPLETE
751,751,0.6836016774177551,2023-05-18 18:38:08.344152,2023-05-18 18:38:15.428985,0 days 00:00:07.084833,tanh,1,0.000235757894104576,2,256,2,1,COMPLETE
752,752,0.68324773311615,2023-05-18 18:38:15.430141,2023-05-18 18:38:25.360833,0 days 00:00:09.930692,sigmoid,1,0.02804592150992165,8,512,2,1,COMPLETE
753,753,0.6811584234237671,2023-05-18 18:38:25.362012,2023-05-18 18:38:32.202452,0 days 00:00:06.840440,sigmoid,1,0.000296532827831791,2,256,1,1,COMPLETE
754,754,0.6631329655647278,2023-05-18 18:38:32.203622,2023-05-18 18:38:39.373468,0 days 00:00:07.169846,sigmoid,1,0.00016162734448560138,2,512,2,0,COMPLETE
755,755,0.6664134383201599,2023-05-18 18:38:39.374635,2023-05-18 18:38:46.504899,0 days 00:00:07.130264,sigmoid,1,0.0004037131348790602,2,512,2,1,COMPLETE
756,756,0.6625548958778381,2023-05-18 18:38:46.506159,2023-05-18 18:38:53.292307,0 days 00:00:06.786148,sigmoid,1,0.00019620479918989634,2,256,2,1,COMPLETE
757,757,0.6867761731147766,2023-05-18 18:38:53.293448,2023-05-18 18:38:59.868528,0 days 00:00:06.575080,linear,0,0.00024744722297361925,2,512,2,1,COMPLETE
758,758,0.6941669583320618,2023-05-18 18:38:59.869647,2023-05-18 18:39:07.454409,0 days 00:00:07.584762,relu,1,5.461326584472892e-05,2,256,2,1,COMPLETE
759,759,0.6748368859291076,2023-05-18 18:39:07.455631,2023-05-18 18:39:15.142757,0 days 00:00:07.687126,sigmoid,1,0.09574706169770456,3,64,2,0,COMPLETE
760,760,0.6695606470108032,2023-05-18 18:39:15.143975,2023-05-18 18:39:22.229315,0 days 00:00:07.085340,sigmoid,1,0.0006042032976647841,2,512,2,1,COMPLETE
761,761,0.6683738708496094,2023-05-18 18:39:22.230472,2023-05-18 18:39:28.963324,0 days 00:00:06.732852,sigmoid,1,2.256426141042801e-05,2,512,2,1,COMPLETE
762,762,0.6669755101203918,2023-05-18 18:39:28.964506,2023-05-18 18:39:36.725679,0 days 00:00:07.761173,sigmoid,1,0.0003352394284438396,6,256,2,1,COMPLETE
763,763,0.6809712409973144,2023-05-18 18:39:36.726797,2023-05-18 18:39:44.074984,0 days 00:00:07.348187,sigmoid,1,0.0001705982351422784,2,512,3,1,COMPLETE
764,764,0.8312186956405639,2023-05-18 18:39:44.076314,2023-05-18 18:39:51.146509,0 days 00:00:07.070195,elu,1,0.004556826547948204,2,256,2,0,COMPLETE
765,765,0.6880979061126709,2023-05-18 18:39:51.147661,2023-05-18 18:39:59.110273,0 days 00:00:07.962612,gelu,1,7.17225978376552e-05,2,512,2,1,COMPLETE
766,766,0.7924179077148438,2023-05-18 18:39:59.111423,2023-05-18 18:40:06.433834,0 days 00:00:07.322411,sigmoid,1,0.01602800500799849,3,128,2,1,COMPLETE
767,767,0.6632129788398743,2023-05-18 18:40:06.434958,2023-05-18 18:40:13.608074,0 days 00:00:07.173116,sigmoid,1,0.00020236362991595208,2,512,2,1,COMPLETE
768,768,0.6635177373886109,2023-05-18 18:40:13.609221,2023-05-18 18:40:20.635241,0 days 00:00:07.026020,sigmoid,1,0.0004792003903368821,2,256,2,1,COMPLETE
769,769,0.6704164266586303,2023-05-18 18:40:20.636423,2023-05-18 18:40:28.410306,0 days 00:00:07.773883,sigmoid,1,0.000284779983227017,2,512,0,0,COMPLETE
770,770,0.6646494150161744,2023-05-18 18:40:28.411614,2023-05-18 18:40:36.230900,0 days 00:00:07.819286,sigmoid,1,0.00014832527854825368,2,256,2,1,COMPLETE
771,771,0.699411678314209,2023-05-18 18:40:36.232215,2023-05-18 18:40:43.056202,0 days 00:00:06.823987,sigmoid,1,0.05675643439248885,2,512,2,1,COMPLETE
772,772,0.6691280603408813,2023-05-18 18:40:43.057365,2023-05-18 18:40:51.334372,0 days 00:00:08.277007,sigmoid,1,0.000233256390844934,6,512,2,1,COMPLETE
773,773,0.7238038659095765,2023-05-18 18:40:51.335520,2023-05-18 18:40:58.428588,0 days 00:00:07.093068,selu,1,0.0011168321476181806,2,256,2,1,COMPLETE
774,774,0.662401270866394,2023-05-18 18:40:58.429727,2023-05-18 18:41:05.955946,0 days 00:00:07.526219,sigmoid,1,0.0001810636959977214,2,512,2,0,COMPLETE
775,775,0.6629917740821838,2023-05-18 18:41:05.957143,2023-05-18 18:41:13.802251,0 days 00:00:07.845108,sigmoid,1,0.0001466449741662155,2,256,2,1,COMPLETE
776,776,0.6647427558898926,2023-05-18 18:41:13.803728,2023-05-18 18:41:20.710526,0 days 00:00:06.906798,sigmoid,0,0.0002888405143378661,2,512,2,1,COMPLETE
777,777,0.6751679658889771,2023-05-18 18:41:20.711709,2023-05-18 18:41:27.602057,0 days 00:00:06.890348,sigmoid,1,0.00099598333816076,2,256,1,1,COMPLETE
778,778,0.6674028635025024,2023-05-18 18:41:27.603387,2023-05-18 18:41:34.618901,0 days 00:00:07.015514,sigmoid,1,0.00037946547683203637,2,512,2,1,COMPLETE
779,779,0.6739709138870239,2023-05-18 18:41:34.620090,2023-05-18 18:41:41.466137,0 days 00:00:06.846047,sigmoid,1,0.0034140354299946364,2,512,2,0,COMPLETE
780,780,0.8311975598335266,2023-05-18 18:41:41.467266,2023-05-18 18:41:49.391788,0 days 00:00:07.924522,tanh,1,0.0038254983354687314,2,256,2,1,COMPLETE
781,781,0.6776164770126343,2023-05-18 18:41:49.392994,2023-05-18 18:41:56.539542,0 days 00:00:07.146548,sigmoid,1,0.01988881315541036,2,512,2,1,COMPLETE
782,782,0.7131815075874328,2023-05-18 18:41:56.540785,2023-05-18 18:42:03.455799,0 days 00:00:06.915014,sigmoid,1,0.03190552706867859,2,256,2,1,COMPLETE
783,783,0.6689178586006165,2023-05-18 18:42:03.457115,2023-05-18 18:42:10.898606,0 days 00:00:07.441491,sigmoid,1,0.00021740563853386898,3,64,2,1,COMPLETE
784,784,0.712835943698883,2023-05-18 18:42:10.899776,2023-05-18 18:42:17.629218,0 days 00:00:06.729442,linear,1,0.001597205284727575,2,512,2,1,COMPLETE
785,785,0.7646238207817078,2023-05-18 18:42:17.630395,2023-05-18 18:42:28.119751,0 days 00:00:10.489356,sigmoid,1,0.09826029068325735,9,512,2,0,COMPLETE
786,786,0.6680739998817444,2023-05-18 18:42:28.120946,2023-05-18 18:42:35.486880,0 days 00:00:07.365934,sigmoid,1,0.0007131915184447501,2,256,2,1,COMPLETE
787,787,0.7140469074249267,2023-05-18 18:42:35.488074,2023-05-18 18:42:42.507018,0 days 00:00:07.018944,relu,1,0.02405035781130066,2,512,3,1,COMPLETE
788,788,0.6760301947593689,2023-05-18 18:42:42.508200,2023-05-18 18:42:49.584241,0 days 00:00:07.076041,sigmoid,1,0.0013489482085559776,3,256,2,1,COMPLETE
789,789,0.6622953414916992,2023-05-18 18:42:49.585486,2023-05-18 18:42:56.726626,0 days 00:00:07.141140,sigmoid,1,0.00017227843949466589,2,512,2,1,COMPLETE
790,790,0.6921122908592224,2023-05-18 18:42:56.727796,2023-05-18 18:43:03.360346,0 days 00:00:06.632550,sigmoid,1,0.05286418652024396,2,512,2,0,COMPLETE
791,791,0.6759635210037231,2023-05-18 18:43:03.361479,2023-05-18 18:43:10.971313,0 days 00:00:07.609834,sigmoid,1,0.06665432792026099,2,256,2,1,COMPLETE
792,792,0.6752475023269653,2023-05-18 18:43:10.972543,2023-05-18 18:43:18.469291,0 days 00:00:07.496748,sigmoid,1,0.00024921853357773863,2,512,0,1,COMPLETE
793,793,0.6966718912124634,2023-05-18 18:43:18.471713,2023-05-18 18:43:25.559796,0 days 00:00:07.088083,elu,1,0.0003495044390201084,2,256,2,1,COMPLETE
794,794,0.6653046250343323,2023-05-18 18:43:25.560965,2023-05-18 18:43:32.346798,0 days 00:00:06.785833,sigmoid,1,0.00014369732687619457,2,128,2,1,COMPLETE
795,795,1.937212085723877,2023-05-18 18:43:32.347976,2023-05-18 18:43:41.253341,0 days 00:00:08.905365,gelu,1,0.0022178089696412084,4,512,2,0,COMPLETE
796,796,0.6637593388557435,2023-05-18 18:43:41.254503,2023-05-18 18:43:48.832902,0 days 00:00:07.578399,sigmoid,1,0.00020201110772899317,2,512,2,1,COMPLETE
797,797,0.6639873623847962,2023-05-18 18:43:48.834087,2023-05-18 18:43:55.937011,0 days 00:00:07.102924,sigmoid,0,0.00045350612950680725,2,256,2,1,COMPLETE
798,798,0.6633064866065979,2023-05-18 18:43:55.938191,2023-05-18 18:44:02.899069,0 days 00:00:06.960878,sigmoid,1,0.00010581610467194974,2,512,2,1,COMPLETE
799,799,0.6633081436157227,2023-05-18 18:44:02.900247,2023-05-18 18:44:09.997445,0 days 00:00:07.097198,sigmoid,1,0.00031806946922372214,2,256,2,1,COMPLETE
800,800,0.6636384487152099,2023-05-18 18:44:09.998621,2023-05-18 18:44:17.798212,0 days 00:00:07.799591,sigmoid,1,0.00026835052688320936,2,512,2,0,COMPLETE
801,801,0.6681553244590759,2023-05-18 18:44:17.799394,2023-05-18 18:44:24.932936,0 days 00:00:07.133542,sigmoid,1,3.601759046927806e-05,2,256,2,1,COMPLETE
802,802,0.7419132709503173,2023-05-18 18:44:24.934111,2023-05-18 18:44:32.949443,0 days 00:00:08.015332,selu,1,8.005922131229714e-05,3,512,2,1,COMPLETE
803,803,0.678232479095459,2023-05-18 18:44:32.950640,2023-05-18 18:44:40.168906,0 days 00:00:07.218266,sigmoid,1,0.00016535179667922557,2,512,1,1,COMPLETE
804,804,0.6643490672111512,2023-05-18 18:44:40.170063,2023-05-18 18:44:47.529527,0 days 00:00:07.359464,sigmoid,1,0.00013611292204644077,2,256,2,1,COMPLETE
805,805,0.6733874201774597,2023-05-18 18:44:47.530693,2023-05-18 18:44:54.279724,0 days 00:00:06.749031,sigmoid,1,0.001882225968136654,2,512,2,0,COMPLETE
806,806,0.6661263465881347,2023-05-18 18:44:54.280939,2023-05-18 18:45:01.404028,0 days 00:00:07.123089,sigmoid,1,0.0002275989850390095,2,64,2,1,COMPLETE
807,807,0.6674285531044006,2023-05-18 18:45:01.405183,2023-05-18 18:45:08.560495,0 days 00:00:07.155312,sigmoid,1,4.6576932383724016e-05,2,256,2,1,COMPLETE
808,808,0.874095869064331,2023-05-18 18:45:08.561791,2023-05-18 18:45:17.779827,0 days 00:00:09.218036,tanh,1,0.00019362141524035444,5,512,2,1,COMPLETE
809,809,0.6628489851951599,2023-05-18 18:45:17.781025,2023-05-18 18:45:24.894572,0 days 00:00:07.113547,sigmoid,1,0.00012214238979698567,2,512,2,1,COMPLETE
810,810,0.6622139692306519,2023-05-18 18:45:24.895775,2023-05-18 18:45:31.623071,0 days 00:00:06.727296,sigmoid,1,0.0002751551426109214,2,256,2,0,COMPLETE
811,811,0.6637523293495178,2023-05-18 18:45:31.624249,2023-05-18 18:45:38.496407,0 days 00:00:06.872158,sigmoid,1,0.00032077486898893,2,256,2,1,COMPLETE
812,812,0.6822955727577209,2023-05-18 18:45:38.497583,2023-05-18 18:45:44.988586,0 days 00:00:06.491003,sigmoid,1,0.00027001733449703153,2,256,3,1,COMPLETE
813,813,0.6962392687797546,2023-05-18 18:45:44.989774,2023-05-18 18:45:52.654986,0 days 00:00:07.665212,linear,1,0.00037520209272356823,2,256,2,1,COMPLETE
814,814,0.6630374312400817,2023-05-18 18:45:52.656189,2023-05-18 18:46:00.603601,0 days 00:00:07.947412,sigmoid,0,0.0005369164996486651,3,256,2,0,COMPLETE
815,815,0.6633545756340027,2023-05-18 18:46:00.604962,2023-05-18 18:46:07.895333,0 days 00:00:07.290371,sigmoid,1,0.00041991963302512997,2,256,2,1,COMPLETE
816,816,0.6918898463249207,2023-05-18 18:46:07.896528,2023-05-18 18:46:14.670890,0 days 00:00:06.774362,relu,1,0.0002758293763282611,2,256,2,1,COMPLETE
817,817,0.6632824659347534,2023-05-18 18:46:14.672061,2023-05-18 18:46:21.547616,0 days 00:00:06.875555,sigmoid,1,0.00023561420780371812,2,256,2,1,COMPLETE
818,818,0.664309287071228,2023-05-18 18:46:21.548975,2023-05-18 18:46:28.255449,0 days 00:00:06.706474,sigmoid,1,0.0003249285786723458,2,256,0,1,COMPLETE
819,819,0.6628101825714111,2023-05-18 18:46:28.256653,2023-05-18 18:46:35.861116,0 days 00:00:07.604463,sigmoid,1,0.00022299864464671594,2,256,2,0,COMPLETE
820,820,0.690399169921875,2023-05-18 18:46:35.862327,2023-05-18 18:46:43.314441,0 days 00:00:07.452114,sigmoid,1,0.005438934429707548,2,256,2,1,COMPLETE
821,821,0.6615662336349487,2023-05-18 18:46:43.315620,2023-05-18 18:46:50.170981,0 days 00:00:06.855361,sigmoid,1,0.0003055422104628153,2,256,2,1,COMPLETE
822,822,0.6630666494369507,2023-05-18 18:46:50.172170,2023-05-18 18:46:57.005571,0 days 00:00:06.833401,sigmoid,1,0.0003929848420419144,2,256,2,1,COMPLETE
823,823,0.6913535714149475,2023-05-18 18:46:57.006735,2023-05-18 18:47:03.771891,0 days 00:00:06.765156,elu,1,0.00032344958483539513,2,256,2,1,COMPLETE
824,824,0.6647205948829651,2023-05-18 18:47:03.773055,2023-05-18 18:47:10.513281,0 days 00:00:06.740226,sigmoid,1,0.0005169545735432763,2,256,2,1,COMPLETE
825,825,0.701193904876709,2023-05-18 18:47:10.514430,2023-05-18 18:47:18.978081,0 days 00:00:08.463651,gelu,1,0.0002955666182399397,2,256,2,0,COMPLETE
826,826,0.6826711177825928,2023-05-18 18:47:18.979287,2023-05-18 18:47:25.898650,0 days 00:00:06.919363,sigmoid,1,0.00041614035304727665,2,256,1,1,COMPLETE
827,827,0.6649731040000916,2023-05-18 18:47:25.899848,2023-05-18 18:47:33.681956,0 days 00:00:07.782108,sigmoid,1,0.0002674740423701848,3,256,2,1,COMPLETE
828,828,0.6627981185913085,2023-05-18 18:47:33.683145,2023-05-18 18:47:40.883108,0 days 00:00:07.199963,sigmoid,1,0.00037190716081717874,2,256,2,1,COMPLETE
829,829,0.662920606136322,2023-05-18 18:47:40.884467,2023-05-18 18:47:48.285820,0 days 00:00:07.401353,sigmoid,1,0.00029447948004037203,2,256,2,1,COMPLETE
830,830,0.6622505784034729,2023-05-18 18:47:48.287021,2023-05-18 18:47:56.793357,0 days 00:00:08.506336,sigmoid,1,0.00023234106569732971,2,256,2,0,COMPLETE
831,831,0.6848849773406982,2023-05-18 18:47:56.794568,2023-05-18 18:48:04.643110,0 days 00:00:07.848542,sigmoid,1,0.012933269660985533,2,256,2,1,COMPLETE
832,832,0.8289785981178284,2023-05-18 18:48:04.644349,2023-05-18 18:48:12.281640,0 days 00:00:07.637291,selu,1,0.009504426630962537,2,256,2,1,COMPLETE
833,833,0.6731131792068481,2023-05-18 18:48:12.282834,2023-05-18 18:48:19.758590,0 days 00:00:07.475756,sigmoid,0,2.2494216919955107e-05,3,256,2,1,COMPLETE
834,834,0.6623147964477539,2023-05-18 18:48:19.759901,2023-05-18 18:48:27.453248,0 days 00:00:07.693347,sigmoid,1,0.00034805980490848704,2,256,2,1,COMPLETE
835,835,0.6657863736152649,2023-05-18 18:48:27.454427,2023-05-18 18:48:34.229278,0 days 00:00:06.774851,sigmoid,1,0.00048050128393562467,2,256,2,0,COMPLETE
836,836,0.666138517856598,2023-05-18 18:48:34.230458,2023-05-18 18:48:41.776093,0 days 00:00:07.545635,sigmoid,1,0.0006807796207658421,2,256,2,1,COMPLETE
837,837,0.6852088928222656,2023-05-18 18:48:41.777497,2023-05-18 18:48:49.338369,0 days 00:00:07.560872,sigmoid,1,0.00026088894802521456,2,256,3,1,COMPLETE
838,838,0.6821321725845337,2023-05-18 18:48:49.339597,2023-05-18 18:48:56.449941,0 days 00:00:07.110344,tanh,1,0.0002162642016413043,2,256,2,1,COMPLETE
839,839,0.6843812346458436,2023-05-18 18:48:56.451108,2023-05-18 18:49:03.248611,0 days 00:00:06.797503,sigmoid,1,0.004605125622600597,2,256,2,1,COMPLETE
840,840,0.6626206636428833,2023-05-18 18:49:03.249812,2023-05-18 18:49:10.436950,0 days 00:00:07.187138,sigmoid,1,0.0001940472279322409,2,256,2,0,COMPLETE
841,841,0.6730860352516175,2023-05-18 18:49:10.438145,2023-05-18 18:49:18.167743,0 days 00:00:07.729598,sigmoid,1,1.8391455031139843e-05,2,256,0,1,COMPLETE
842,842,0.6623815178871155,2023-05-18 18:49:18.168922,2023-05-18 18:49:25.768526,0 days 00:00:07.599604,sigmoid,1,0.00031205417328886446,2,256,2,1,COMPLETE
843,843,0.6888991713523864,2023-05-18 18:49:25.769785,2023-05-18 18:49:32.826467,0 days 00:00:07.056682,linear,1,0.00027409200107188106,2,256,2,1,COMPLETE
