,number,value,datetime_start,datetime_complete,duration,params_activation,params_hidden_initializer,params_lr,params_n_layers,params_neurons,params_optimizer,params_output_initializer,state
562,562,0.7309223413467407,2023-05-18 18:15:29.187311,2023-05-18 18:15:36.699104,0 days 00:00:07.511793,sigmoid,1,0.008673821037569565,2,128,2,1,COMPLETE
563,563,0.6749773025512695,2023-05-18 18:15:36.700249,2023-05-18 18:15:43.726482,0 days 00:00:07.026233,sigmoid,0,0.003290356628451561,2,512,2,0,COMPLETE
564,564,0.7140176296234131,2023-05-18 18:15:43.727641,2023-05-18 18:15:50.705904,0 days 00:00:06.978263,sigmoid,1,0.07250751786421702,2,512,2,0,COMPLETE
565,565,0.69128338098526,2023-05-18 18:15:50.708041,2023-05-18 18:15:57.685563,0 days 00:00:06.977522,sigmoid,1,0.00013713259603053224,2,512,3,0,COMPLETE
566,566,0.6652342200279235,2023-05-18 18:15:57.686642,2023-05-18 18:16:04.688945,0 days 00:00:07.002303,sigmoid,1,9.52059145554406e-05,2,256,2,0,COMPLETE
567,567,0.704317307472229,2023-05-18 18:16:04.690098,2023-05-18 18:16:11.324235,0 days 00:00:06.634137,selu,1,0.00011144998517828737,2,512,2,0,COMPLETE
568,568,0.6883774161338806,2023-05-18 18:16:11.326323,2023-05-18 18:16:18.933363,0 days 00:00:07.607040,sigmoid,1,0.05653922331181627,2,512,2,0,COMPLETE
569,569,0.6622657656669617,2023-05-18 18:16:18.934493,2023-05-18 18:16:26.370946,0 days 00:00:07.436453,sigmoid,1,0.00015794621653619466,2,512,2,0,COMPLETE
570,570,0.6646124005317688,2023-05-18 18:16:26.372077,2023-05-18 18:16:33.902411,0 days 00:00:07.530334,sigmoid,1,0.00014573994697170446,2,512,2,0,COMPLETE
571,571,0.6653263330459595,2023-05-18 18:16:33.903656,2023-05-18 18:16:40.670326,0 days 00:00:06.766670,sigmoid,1,8.284675180325292e-05,2,512,0,0,COMPLETE
572,572,0.6829726219177246,2023-05-18 18:16:40.671454,2023-05-18 18:16:47.386617,0 days 00:00:06.715163,tanh,1,0.00012819610391023273,2,512,2,0,COMPLETE
573,573,0.6627580642700195,2023-05-18 18:16:47.387705,2023-05-18 18:16:54.726797,0 days 00:00:07.339092,sigmoid,1,0.00016762997158669625,2,512,2,0,COMPLETE
574,574,0.6633831620216369,2023-05-18 18:16:54.728163,2023-05-18 18:17:01.904174,0 days 00:00:07.176011,sigmoid,1,0.0001997755711847794,2,512,2,0,COMPLETE
575,575,0.6625235319137573,2023-05-18 18:17:01.907989,2023-05-18 18:17:08.788314,0 days 00:00:06.880325,sigmoid,1,0.00010721030665374475,2,512,2,0,COMPLETE
576,576,0.671411144733429,2023-05-18 18:17:08.789545,2023-05-18 18:17:15.538205,0 days 00:00:06.748660,sigmoid,1,0.0012879752981690775,2,256,2,0,COMPLETE
577,577,0.7304243326187134,2023-05-18 18:17:15.539415,2023-05-18 18:17:22.512930,0 days 00:00:06.973515,linear,1,0.001682237700146798,2,512,2,0,COMPLETE
578,578,0.6629768013954163,2023-05-18 18:17:22.514028,2023-05-18 18:17:29.581263,0 days 00:00:07.067235,sigmoid,1,0.00015053864675246623,2,512,2,0,COMPLETE
579,579,0.7490505576133728,2023-05-18 18:17:29.582353,2023-05-18 18:17:36.983791,0 days 00:00:07.401438,sigmoid,1,0.00025624508308447224,2,64,1,0,COMPLETE
580,580,0.6927310466766358,2023-05-18 18:17:36.984939,2023-05-18 18:17:44.081055,0 days 00:00:07.096116,relu,1,0.00012691206399452118,2,512,2,0,COMPLETE
581,581,0.6636312484741211,2023-05-18 18:17:44.082163,2023-05-18 18:17:50.863812,0 days 00:00:06.781649,sigmoid,1,0.00019368939692590963,2,512,2,0,COMPLETE
582,582,0.6651793599128724,2023-05-18 18:17:50.864903,2023-05-18 18:17:57.649843,0 days 00:00:06.784940,sigmoid,0,0.00016032819517329314,2,512,2,0,COMPLETE
583,583,0.6738116025924683,2023-05-18 18:17:57.650922,2023-05-18 18:18:04.361865,0 days 00:00:06.710943,sigmoid,1,0.0010308129901218232,2,512,2,0,COMPLETE
584,584,0.6741670846939087,2023-05-18 18:18:04.363095,2023-05-18 18:18:13.938625,0 days 00:00:09.575530,sigmoid,1,7.085493487196113e-05,8,512,2,0,COMPLETE
585,585,0.6662085890769959,2023-05-18 18:18:13.939757,2023-05-18 18:18:21.141502,0 days 00:00:07.201745,sigmoid,1,9.506031445081193e-05,2,256,2,0,COMPLETE
586,586,0.787558114528656,2023-05-18 18:18:21.142619,2023-05-18 18:18:31.129619,0 days 00:00:09.987000,elu,1,2.6782123783621234e-05,10,512,2,0,COMPLETE
587,587,0.7316021919250488,2023-05-18 18:18:31.130723,2023-05-18 18:18:38.459994,0 days 00:00:07.329271,gelu,1,0.00036982728872368215,2,512,2,1,COMPLETE
588,588,0.6662197709083557,2023-05-18 18:18:38.461067,2023-05-18 18:18:45.106274,0 days 00:00:06.645207,sigmoid,1,0.000118186541296929,2,128,2,1,COMPLETE
589,589,0.6635145783424378,2023-05-18 18:18:45.108610,2023-05-18 18:18:52.984404,0 days 00:00:07.875794,sigmoid,1,0.00022706634720541944,2,512,2,1,COMPLETE
590,590,0.6690500020980835,2023-05-18 18:18:52.985686,2023-05-18 18:19:00.021697,0 days 00:00:07.036011,sigmoid,1,0.0008747240586042805,2,512,2,1,COMPLETE
591,591,0.6627368092536926,2023-05-18 18:19:00.025670,2023-05-18 18:19:06.834152,0 days 00:00:06.808482,sigmoid,1,0.0001413716636720054,2,512,2,0,COMPLETE
592,592,0.6790905356407165,2023-05-18 18:19:06.835323,2023-05-18 18:19:13.810984,0 days 00:00:06.975661,sigmoid,1,0.04297390331978826,2,512,3,1,COMPLETE
593,593,0.6626294732093811,2023-05-18 18:19:13.812233,2023-05-18 18:19:20.440721,0 days 00:00:06.628488,sigmoid,1,0.0001781006102212342,2,512,2,1,COMPLETE
594,594,0.6658309698104858,2023-05-18 18:19:20.441802,2023-05-18 18:19:27.030802,0 days 00:00:06.589000,sigmoid,1,0.0002761507222492696,2,256,0,1,COMPLETE
595,595,0.7542320847511291,2023-05-18 18:19:27.031928,2023-05-18 18:19:34.627148,0 days 00:00:07.595220,selu,1,0.049729968150410704,2,512,2,1,COMPLETE
596,596,0.6653803586959839,2023-05-18 18:19:34.628332,2023-05-18 18:19:41.911802,0 days 00:00:07.283470,sigmoid,1,4.667536627797585e-05,2,512,2,1,COMPLETE
597,597,0.6646645188331604,2023-05-18 18:19:41.912914,2023-05-18 18:19:49.157900,0 days 00:00:07.244986,sigmoid,1,0.00015748788465611742,2,512,2,0,COMPLETE
598,598,0.6765213131904602,2023-05-18 18:19:49.158987,2023-05-18 18:19:57.946813,0 days 00:00:08.787826,sigmoid,1,0.00021388250611367968,7,512,2,1,COMPLETE
599,599,0.6756422758102417,2023-05-18 18:19:57.947917,2023-05-18 18:20:07.628258,0 days 00:00:09.680341,sigmoid,1,0.0038404682203253336,9,512,2,1,COMPLETE
600,600,0.6627992987632751,2023-05-18 18:20:07.629566,2023-05-18 18:20:14.656355,0 days 00:00:07.026789,sigmoid,1,0.00011746768846175267,2,512,2,1,COMPLETE
601,601,0.6875513911247253,2023-05-18 18:20:14.657496,2023-05-18 18:20:21.800121,0 days 00:00:07.142625,tanh,0,0.00017931046305469074,2,512,2,1,COMPLETE
602,602,0.6689700841903686,2023-05-18 18:20:21.801207,2023-05-18 18:20:29.293112,0 days 00:00:07.491905,sigmoid,1,9.201763075775639e-05,2,64,2,0,COMPLETE
603,603,0.6945973873138428,2023-05-18 18:20:29.294210,2023-05-18 18:20:35.932357,0 days 00:00:06.638147,sigmoid,1,0.00014153264104476294,2,512,1,1,COMPLETE
604,604,0.6618330478668213,2023-05-18 18:20:35.933464,2023-05-18 18:20:42.995398,0 days 00:00:07.061934,sigmoid,1,0.00024627133542308937,2,256,2,1,COMPLETE
605,605,0.6622730731964112,2023-05-18 18:20:42.996503,2023-05-18 18:20:50.396425,0 days 00:00:07.399922,sigmoid,1,0.00024036220109024598,2,256,2,1,COMPLETE
606,606,0.6624675512313842,2023-05-18 18:20:50.397569,2023-05-18 18:20:57.528666,0 days 00:00:07.131097,sigmoid,1,0.0003011113471190507,2,256,2,1,COMPLETE
607,607,0.6633766055107116,2023-05-18 18:20:57.530004,2023-05-18 18:21:04.487640,0 days 00:00:06.957636,sigmoid,1,0.00031462080571910016,2,256,2,1,COMPLETE
608,608,0.6629128336906434,2023-05-18 18:21:04.488764,2023-05-18 18:21:11.707827,0 days 00:00:07.219063,sigmoid,1,0.0003472256367108162,2,256,2,1,COMPLETE
609,609,0.6923018813133239,2023-05-18 18:21:11.709073,2023-05-18 18:21:18.848484,0 days 00:00:07.139411,relu,1,0.00025441810969698014,2,256,2,0,COMPLETE
610,610,0.6971933126449585,2023-05-18 18:21:18.849741,2023-05-18 18:21:25.454198,0 days 00:00:06.604457,sigmoid,1,0.005188008363413179,2,256,2,1,COMPLETE
611,611,0.6624444723129272,2023-05-18 18:21:25.455409,2023-05-18 18:21:32.976664,0 days 00:00:07.521255,sigmoid,1,0.0002492177726561695,2,256,2,1,COMPLETE
612,612,0.68781498670578,2023-05-18 18:21:32.978056,2023-05-18 18:21:39.972865,0 days 00:00:06.994809,sigmoid,1,0.005668181167892999,2,256,2,1,COMPLETE
613,613,0.7038501024246215,2023-05-18 18:21:39.974110,2023-05-18 18:21:47.239502,0 days 00:00:07.265392,sigmoid,1,0.01125943180289856,2,256,2,1,COMPLETE
614,614,0.7016404867172241,2023-05-18 18:21:47.240622,2023-05-18 18:21:54.270948,0 days 00:00:07.030326,linear,1,0.0004941491474333095,3,256,2,0,COMPLETE
615,615,0.6914790391921997,2023-05-18 18:21:54.272210,2023-05-18 18:22:01.476134,0 days 00:00:07.203924,elu,1,0.0002348080238301848,2,256,2,1,COMPLETE
616,616,0.6803349494934082,2023-05-18 18:22:01.477355,2023-05-18 18:22:08.343998,0 days 00:00:06.866643,sigmoid,1,0.0004115018067132432,2,256,3,1,COMPLETE
617,617,0.6916061878204346,2023-05-18 18:22:08.345071,2023-05-18 18:22:16.787807,0 days 00:00:08.442736,gelu,1,0.00029562662152102026,2,256,2,1,COMPLETE
618,618,0.6629278898239136,2023-05-18 18:22:16.788973,2023-05-18 18:22:24.009277,0 days 00:00:07.220304,sigmoid,1,0.0002092002252793974,2,256,2,1,COMPLETE
619,619,0.6829270958900452,2023-05-18 18:22:24.010375,2023-05-18 18:22:30.867382,0 days 00:00:06.857007,sigmoid,1,0.05595489058155811,2,256,2,0,COMPLETE
620,620,0.6711729049682618,2023-05-18 18:22:30.868632,2023-05-18 18:22:37.910794,0 days 00:00:07.042162,sigmoid,1,0.0006968000405635811,3,256,0,1,COMPLETE
621,621,0.6627834439277649,2023-05-18 18:22:37.911913,2023-05-18 18:22:44.665161,0 days 00:00:06.753248,sigmoid,1,0.00020517004544641024,2,256,2,1,COMPLETE
622,622,0.6856296777725219,2023-05-18 18:22:44.666241,2023-05-18 18:22:52.127704,0 days 00:00:07.461463,sigmoid,0,0.002224828172743681,2,256,2,1,COMPLETE
623,623,0.6702523231506348,2023-05-18 18:22:52.128820,2023-05-18 18:22:59.874032,0 days 00:00:07.745212,sigmoid,1,3.3076816068494755e-05,2,256,2,1,COMPLETE
624,624,0.7093691110610962,2023-05-18 18:22:59.875335,2023-05-18 18:23:07.489600,0 days 00:00:07.614265,sigmoid,1,0.03597646888080525,2,256,2,0,COMPLETE
625,625,0.8845611810684204,2023-05-18 18:23:07.490716,2023-05-18 18:23:15.113514,0 days 00:00:07.622798,selu,1,0.00034857802107065054,5,256,2,1,COMPLETE
626,626,0.6620693206787109,2023-05-18 18:23:15.114630,2023-05-18 18:23:22.137693,0 days 00:00:07.023063,sigmoid,1,0.0002631762876400754,2,256,2,1,COMPLETE
627,627,0.6626059412956238,2023-05-18 18:23:22.138792,2023-05-18 18:23:29.558283,0 days 00:00:07.419491,sigmoid,1,0.0002783180636941528,2,256,2,1,COMPLETE
628,628,0.6655495166778564,2023-05-18 18:23:29.559334,2023-05-18 18:23:37.257907,0 days 00:00:07.698573,sigmoid,1,0.00040730493142968017,2,256,2,1,COMPLETE
629,629,0.662434720993042,2023-05-18 18:23:37.259759,2023-05-18 18:23:44.305848,0 days 00:00:07.046089,sigmoid,1,0.00024277305165691345,2,256,2,1,COMPLETE
630,630,0.6609845876693725,2023-05-18 18:23:44.306971,2023-05-18 18:23:51.046258,0 days 00:00:06.739287,sigmoid,1,0.0003178856838037658,2,256,2,1,COMPLETE
631,631,0.7133778095245361,2023-05-18 18:23:51.047708,2023-05-18 18:23:58.024116,0 days 00:00:06.976408,sigmoid,1,0.0002467970357342749,2,256,1,1,COMPLETE
632,632,0.6626427292823791,2023-05-18 18:23:58.025252,2023-05-18 18:24:04.696948,0 days 00:00:06.671696,sigmoid,1,0.0003867894390777174,2,256,2,1,COMPLETE
633,633,0.6626551866531372,2023-05-18 18:24:04.698171,2023-05-18 18:24:12.323517,0 days 00:00:07.625346,sigmoid,1,0.000254962526189981,2,256,2,1,COMPLETE
634,634,0.6896852731704712,2023-05-18 18:24:12.327409,2023-05-18 18:24:19.946764,0 days 00:00:07.619355,tanh,1,0.0003018103263351897,2,256,2,1,COMPLETE
635,635,0.6621788501739502,2023-05-18 18:24:19.947910,2023-05-18 18:24:27.322166,0 days 00:00:07.374256,sigmoid,1,0.00031277923491509915,2,256,2,1,COMPLETE
636,636,0.6885306358337402,2023-05-18 18:24:27.323418,2023-05-18 18:24:34.074948,0 days 00:00:06.751530,linear,1,0.00036060793466601053,2,256,2,1,COMPLETE
637,637,0.6636315703392028,2023-05-18 18:24:34.076214,2023-05-18 18:24:41.525651,0 days 00:00:07.449437,sigmoid,1,0.00035157008754176745,3,256,2,1,COMPLETE
638,638,0.6707986116409301,2023-05-18 18:24:41.526725,2023-05-18 18:24:48.204993,0 days 00:00:06.678268,sigmoid,1,2.369523721408213e-05,2,256,2,1,COMPLETE
639,639,0.6992460727691651,2023-05-18 18:24:48.206242,2023-05-18 18:24:55.854854,0 days 00:00:07.648612,relu,1,0.00046001381551791703,2,256,2,1,COMPLETE
640,640,0.6736586809158325,2023-05-18 18:24:55.856012,2023-05-18 18:25:02.826344,0 days 00:00:06.970332,sigmoid,1,0.00759824903501179,2,256,3,1,COMPLETE
641,641,0.6654695987701416,2023-05-18 18:25:02.827465,2023-05-18 18:25:09.691854,0 days 00:00:06.864389,sigmoid,0,0.0005387661200344524,2,256,2,1,COMPLETE
642,642,0.6630833983421326,2023-05-18 18:25:09.692978,2023-05-18 18:25:16.904104,0 days 00:00:07.211126,sigmoid,1,0.0002832746007578462,2,256,2,1,COMPLETE
643,643,0.6626174688339234,2023-05-18 18:25:16.905364,2023-05-18 18:25:23.693498,0 days 00:00:06.788134,sigmoid,1,0.000325699166310741,2,256,2,1,COMPLETE
644,644,0.6628107905387879,2023-05-18 18:25:23.694617,2023-05-18 18:25:30.218459,0 days 00:00:06.523842,sigmoid,1,0.0003039337382363445,2,256,2,1,COMPLETE
645,645,0.663769805431366,2023-05-18 18:25:30.219581,2023-05-18 18:25:37.750339,0 days 00:00:07.530758,sigmoid,1,0.0002019131267056532,2,256,2,1,COMPLETE
646,646,0.7307648539543152,2023-05-18 18:25:37.751489,2023-05-18 18:25:44.764974,0 days 00:00:07.013485,elu,1,0.0005453713777620443,2,256,0,1,COMPLETE
647,647,0.6627663135528564,2023-05-18 18:25:44.766105,2023-05-18 18:25:51.972026,0 days 00:00:07.205921,sigmoid,1,0.0002623742621881699,2,256,2,1,COMPLETE
648,648,0.690906822681427,2023-05-18 18:25:51.973121,2023-05-18 18:25:59.466810,0 days 00:00:07.493689,gelu,1,0.0003946660457683572,2,128,2,1,COMPLETE
649,649,0.6899706125259399,2023-05-18 18:25:59.467950,2023-05-18 18:26:06.845182,0 days 00:00:07.377232,sigmoid,1,0.0030816816222880585,2,256,2,1,COMPLETE
650,650,0.6629935026168823,2023-05-18 18:26:06.846380,2023-05-18 18:26:14.151906,0 days 00:00:07.305526,sigmoid,1,0.00019827768422720637,2,256,2,1,COMPLETE
651,651,0.6621309041976928,2023-05-18 18:26:14.153044,2023-05-18 18:26:21.679528,0 days 00:00:07.526484,sigmoid,1,0.0003190428719310399,3,256,2,1,COMPLETE
652,652,0.6637637853622437,2023-05-18 18:26:21.680915,2023-05-18 18:26:28.675606,0 days 00:00:06.994691,sigmoid,1,0.00027405910187314653,2,256,2,1,COMPLETE
653,653,0.6637410879135132,2023-05-18 18:26:28.676762,2023-05-18 18:26:36.290034,0 days 00:00:07.613272,sigmoid,1,0.00044091424876133606,4,256,2,1,COMPLETE
654,654,0.675456428527832,2023-05-18 18:26:36.291149,2023-05-18 18:26:43.123381,0 days 00:00:06.832232,sigmoid,1,0.00034559541254487356,3,256,1,1,COMPLETE
655,655,0.7364129424095154,2023-05-18 18:26:43.124529,2023-05-18 18:26:49.978208,0 days 00:00:06.853679,selu,1,0.00030816498721304415,3,256,2,1,COMPLETE
656,656,0.6638913750648499,2023-05-18 18:26:49.979285,2023-05-18 18:26:58.175269,0 days 00:00:08.195984,sigmoid,1,0.0003534156268718684,4,256,2,1,COMPLETE
657,657,0.6627674341201782,2023-05-18 18:26:58.176438,2023-05-18 18:27:05.272481,0 days 00:00:07.096043,sigmoid,1,0.00022878510124694116,2,256,2,1,COMPLETE
658,658,0.6624704957008362,2023-05-18 18:27:05.273653,2023-05-18 18:27:13.165354,0 days 00:00:07.891701,sigmoid,1,0.00044868863557268523,3,256,2,1,COMPLETE
659,659,0.6694623112678528,2023-05-18 18:27:13.166470,2023-05-18 18:27:20.230147,0 days 00:00:07.063677,sigmoid,1,5.703534356900849e-05,3,256,2,1,COMPLETE
660,660,0.6630204319953918,2023-05-18 18:27:20.231259,2023-05-18 18:27:27.124809,0 days 00:00:06.893550,sigmoid,1,0.00031869475061665077,3,256,2,1,COMPLETE
661,661,0.7233163356781006,2023-05-18 18:27:27.125901,2023-05-18 18:27:34.406033,0 days 00:00:07.280132,tanh,0,0.0014910489631956795,2,256,2,1,COMPLETE
662,662,0.689687180519104,2023-05-18 18:27:34.407208,2023-05-18 18:27:41.523111,0 days 00:00:07.115903,sigmoid,1,0.02340602390825385,2,256,2,1,COMPLETE
663,663,0.6622087955474854,2023-05-18 18:27:41.524417,2023-05-18 18:27:48.331425,0 days 00:00:06.807008,sigmoid,1,0.0002677670868438925,2,256,2,1,COMPLETE
664,664,0.6653358101844787,2023-05-18 18:27:48.332562,2023-05-18 18:27:55.541833,0 days 00:00:07.209271,sigmoid,1,0.0006584411970688103,2,256,2,1,COMPLETE
665,665,0.6716190338134765,2023-05-18 18:27:55.543090,2023-05-18 18:28:02.046827,0 days 00:00:06.503737,sigmoid,1,0.006650040757998114,2,256,3,1,COMPLETE
666,666,0.6772866368293762,2023-05-18 18:28:02.048205,2023-05-18 18:28:08.629271,0 days 00:00:06.581066,sigmoid,1,1.1031254065751656e-05,2,256,2,1,COMPLETE
667,667,0.6921903371810914,2023-05-18 18:28:08.630485,2023-05-18 18:28:16.136294,0 days 00:00:07.505809,linear,1,0.00027140720797462844,3,256,2,1,COMPLETE
668,668,0.667978310585022,2023-05-18 18:28:16.137458,2023-05-18 18:28:23.462184,0 days 00:00:07.324726,sigmoid,1,0.0008880136401933977,2,256,2,1,COMPLETE
669,669,0.6959985256195068,2023-05-18 18:28:23.463391,2023-05-18 18:28:30.736987,0 days 00:00:07.273596,relu,1,0.00043729247911264093,2,256,2,1,COMPLETE
670,670,0.6630690336227417,2023-05-18 18:28:30.738336,2023-05-18 18:28:37.542463,0 days 00:00:06.804127,sigmoid,1,0.0002458213669908985,2,256,2,1,COMPLETE
671,671,0.6880589485168457,2023-05-18 18:28:37.543657,2023-05-18 18:28:44.243841,0 days 00:00:06.700184,sigmoid,1,0.0039566336995876025,2,256,2,1,COMPLETE
672,672,0.6618245840072632,2023-05-18 18:28:44.244943,2023-05-18 18:28:51.303455,0 days 00:00:07.058512,sigmoid,1,0.0003119751344794501,2,256,2,1,COMPLETE
673,673,0.6644950866699219,2023-05-18 18:28:51.304782,2023-05-18 18:28:58.719820,0 days 00:00:07.415038,sigmoid,1,0.0003554138342399155,2,256,0,1,COMPLETE
674,674,0.6630874991416931,2023-05-18 18:28:58.721001,2023-05-18 18:29:06.014674,0 days 00:00:07.293673,sigmoid,1,0.0003164581474797036,2,256,2,1,COMPLETE
675,675,0.6650989890098572,2023-05-18 18:29:06.015883,2023-05-18 18:29:12.808190,0 days 00:00:06.792307,sigmoid,1,0.0005951174373308574,2,256,2,1,COMPLETE
676,676,0.6968592762947082,2023-05-18 18:29:12.809317,2023-05-18 18:29:19.621229,0 days 00:00:06.811912,elu,1,0.0004123968593123516,2,256,2,1,COMPLETE
677,677,0.6718458771705628,2023-05-18 18:29:19.622341,2023-05-18 18:29:26.404291,0 days 00:00:06.781950,sigmoid,1,1.5976910703643785e-05,2,256,2,1,COMPLETE
678,678,0.6846314787864685,2023-05-18 18:29:26.405388,2023-05-18 18:29:32.996559,0 days 00:00:06.591171,sigmoid,1,0.06841822669418093,2,256,2,1,COMPLETE
679,679,0.6949235200881958,2023-05-18 18:29:32.997769,2023-05-18 18:29:41.413116,0 days 00:00:08.415347,gelu,1,0.000294372042618644,2,256,2,1,COMPLETE
680,680,0.6741796493530273,2023-05-18 18:29:41.414280,2023-05-18 18:29:48.334751,0 days 00:00:06.920471,sigmoid,1,0.006252622507618119,3,256,1,1,COMPLETE
681,681,0.663505470752716,2023-05-18 18:29:48.335959,2023-05-18 18:29:55.133025,0 days 00:00:06.797066,sigmoid,0,0.0002619587811815599,2,256,2,1,COMPLETE
682,682,0.6633127927780151,2023-05-18 18:29:55.134159,2023-05-18 18:30:01.932797,0 days 00:00:06.798638,sigmoid,1,0.0003667460839038045,2,256,2,1,COMPLETE
683,683,0.669869863986969,2023-05-18 18:30:01.933961,2023-05-18 18:30:08.614790,0 days 00:00:06.680829,sigmoid,1,2.15207570453765e-05,2,256,2,1,COMPLETE
684,684,0.6622129201889038,2023-05-18 18:30:08.615943,2023-05-18 18:30:16.159705,0 days 00:00:07.543762,sigmoid,1,0.00022569801309141525,2,256,2,1,COMPLETE
685,685,0.70073481798172,2023-05-18 18:30:16.160855,2023-05-18 18:30:23.429481,0 days 00:00:07.268626,selu,1,0.0002995610043734809,2,256,2,1,COMPLETE
686,686,0.6865204811096192,2023-05-18 18:30:23.430623,2023-05-18 18:30:30.676396,0 days 00:00:07.245773,sigmoid,1,0.015754713037769725,2,256,2,1,COMPLETE
687,687,0.6633558988571167,2023-05-18 18:30:30.677589,2023-05-18 18:30:37.832162,0 days 00:00:07.154573,sigmoid,1,0.00022539916684901173,2,256,2,1,COMPLETE
688,688,0.7055087208747863,2023-05-18 18:30:37.833357,2023-05-18 18:30:44.679389,0 days 00:00:06.846032,sigmoid,1,0.08388503260244477,2,256,2,1,COMPLETE
689,689,0.6649202346801758,2023-05-18 18:30:44.680599,2023-05-18 18:30:51.655821,0 days 00:00:06.975222,sigmoid,1,0.0005222720507026027,2,256,2,1,COMPLETE
690,690,0.6628356218338013,2023-05-18 18:30:51.656908,2023-05-18 18:30:59.432154,0 days 00:00:07.775246,sigmoid,1,0.00024006364637409964,2,256,2,1,COMPLETE
691,691,0.6753109931945801,2023-05-18 18:30:59.433339,2023-05-18 18:31:06.346420,0 days 00:00:06.913081,sigmoid,1,0.0003811880258408655,2,256,3,1,COMPLETE
692,692,0.6867594242095947,2023-05-18 18:31:06.347584,2023-05-18 18:31:13.947766,0 days 00:00:07.600182,tanh,1,0.0003000104456370444,2,256,2,1,COMPLETE
693,693,0.6631600975990295,2023-05-18 18:31:13.948918,2023-05-18 18:31:20.777929,0 days 00:00:06.829011,sigmoid,1,0.00021286748521585162,2,256,2,1,COMPLETE
694,694,0.6705360054969788,2023-05-18 18:31:20.779226,2023-05-18 18:31:27.700262,0 days 00:00:06.921036,sigmoid,1,0.0013520335087581514,3,256,2,1,COMPLETE
695,695,0.6650888323783875,2023-05-18 18:31:27.701576,2023-05-18 18:31:34.342191,0 days 00:00:06.640615,sigmoid,1,0.0002652611848886239,2,64,2,1,COMPLETE
696,696,0.6758875012397766,2023-05-18 18:31:34.343276,2023-05-18 18:31:41.974154,0 days 00:00:07.630878,sigmoid,1,0.0011014268925064927,2,256,0,1,COMPLETE
697,697,0.6637407302856445,2023-05-18 18:31:41.975457,2023-05-18 18:31:49.224344,0 days 00:00:07.248887,sigmoid,1,0.0002054057796511486,2,256,2,1,COMPLETE
698,698,0.6910478591918945,2023-05-18 18:31:49.226767,2023-05-18 18:31:56.509140,0 days 00:00:07.282373,linear,1,0.0003162837766245084,2,256,2,1,COMPLETE
699,699,0.7092692613601684,2023-05-18 18:31:56.510279,2023-05-18 18:32:03.307735,0 days 00:00:06.797456,sigmoid,1,0.026833902771838114,2,256,2,1,COMPLETE
700,700,0.6634646892547608,2023-05-18 18:32:03.308949,2023-05-18 18:32:09.990541,0 days 00:00:06.681592,sigmoid,0,0.0004544637604459237,2,256,2,1,COMPLETE
701,701,0.6796083331108094,2023-05-18 18:32:09.993183,2023-05-18 18:32:17.632518,0 days 00:00:07.639335,relu,1,0.0002390386020175807,2,128,2,1,COMPLETE
702,702,0.6634296178817749,2023-05-18 18:32:17.633727,2023-05-18 18:32:24.856722,0 days 00:00:07.222995,sigmoid,1,0.00018910192258268812,2,256,2,1,COMPLETE
